Filename,URL,Caption,Hashtags,Mentions
0.jpg,https://scontent-zrh1-1.cdninstagram.com/v/t39.30808-6/445512956_903209104940377_3564505021468375057_n.jpg?stp=dst-jpg_e15_fr_s1080x1080&_nc_ht=scontent-zrh1-1.cdninstagram.com&_nc_cat=101&_nc_ohc=ymCqtbs7Ox4Q7kNvgGas5Tk&edm=AA0rjkIAAAAA&ccb=7-5&oh=00_AYCGL9E1-7eo77yLaKWfAfWyk9KpB1IcoQlh9TAYgztqfA&oe=6663DB7B&_nc_sid=49ed71,"San Antonio's Starry Sage: Seek Enlightenment with Astro Ram ji Contact us now +1 682-408-8832 🌠\n\nAs San Antonio's trusted sage of the stars, Astro Ram ji offers enlightening guidance to help you uncover your true path. Embrace cosmic wisdom and embark on a journey of self-discovery with confidence. #sanantonio #astrology #enlightenment #guidance #astroramji #astropredictions 🔮#astrologychart 🌌#psychicenergy 🌠","sanantonio, astropredictions, astrologychart, enlightenment, psychicenergy, astrology, astroramji, guidance",
1.jpg,https://scontent-zrh1-1.cdninstagram.com/v/t51.29350-15/447799005_342641721934841_8994735738725625474_n.webp?stp=dst-jpg_e35&_nc_ht=scontent-zrh1-1.cdninstagram.com&_nc_cat=105&_nc_ohc=NaTxO8TER-cQ7kNvgG51VmD&edm=AA0rjkIBAAAA&ccb=7-5&oh=00_AYDsDRAasTjqZ2i27QU1R1gh36HZ0FVDNkLesG3buBOqvQ&oe=6663D9EA&_nc_sid=49ed71,"Introducing Se'lah's Soul House!\nThis one is for my fellow singers! \nWhether you perform on stage or like to get down in the shower. It's time to unleash your talent! We are coming together in the love and joy of singing \n🎵🥰🤸🏾‍♀️\n\nWhat to expect:\n🎤Music\n🎤Songwriting\n🎤Singing Exercises\n🎤Affirmations\n🎤Ceremonial smoke cleanse\n🎤Sharing circle\n🎤Karaoke nights\n🎤Light snacks and refreshments\n🎉🎶FUN! FUN! FUN!🎶🎉\n\n*Acoustic/brass musicians welcomed! Bring your instruments!* BEATBOXERS come through!!!\n\nIf this sounds like something you'd love to get down with, *SAVE THE DATE, RSVP* with me and get ready to lalalalalaaaaaaaaaaaaaa!!!! \n\nBi-weekly Saturdays at Cosmic Roots\n6pm\n$150 mxn\n\n*Ask me about my Soul Pass!!*\n*It gives you access to all my events at Cosmic Roots plus discounts and freebies from my Soul Kitchen*",,
2.jpg,https://scontent-zrh1-1.cdninstagram.com/v/t51.29350-15/447468687_400668662960619_1013149922487120733_n.heic?stp=dst-jpg_e35&_nc_ht=scontent-zrh1-1.cdninstagram.com&_nc_cat=103&_nc_ohc=s552s4Uo7QQQ7kNvgE1k_gl&edm=AA0rjkIBAAAA&ccb=7-5&oh=00_AYCKBOJms9rTk7sByRp2FPNmOc2FcqplSc4qEXNMCPpbDQ&oe=6663FDA4&_nc_sid=49ed71,#spirituality #love #meditation #spiritualawakening #spiritualgrowth #yoga #spiritualjourney #inspiration #spiritually #spiritualpath #mindfulness #healing #consciousness #spiritualist #quotes #awakening #lightworker #enlightenment #spiritualhealing #spiritualwarrior  #spiritualart #peace #spirit #lawofattraction #art #spiritualized,"consciousness, enlightenment, spiritualist, lawofattraction, spiritualart, awakening, spiritualhealing, spiritualawakening, spiritualpath, quotes, inspiration, mindfulness, spiritualgrowth, yoga, lightworker, art, healing, meditation, spirituality, spiritualized, spirit, love, spiritualwarrior, spiritualjourney, peace, spiritually",
3.jpg,https://scontent-zrh1-1.cdninstagram.com/v/t51.29350-15/447253042_1164083468065029_7000837777483190037_n.jpg?stp=dst-jpg_e35&_nc_ht=scontent-zrh1-1.cdninstagram.com&_nc_cat=109&_nc_ohc=CTHVCaYsL8IQ7kNvgH5HBh0&edm=AA0rjkIBAAAA&ccb=7-5&oh=00_AYBQYFeMbaRAQ7P6GEKX-wSXbJ6UOx4JQrwmOBl_J0o48g&oe=6663F273&_nc_sid=49ed71,"✨Ready to balance your inner world and embark on a spiritual awakening journey? \n\nDiscover our comprehensive “Spiritual Guide on Awakening”!\n\nThis guide is packed with valuable insights and practical strategies to help you harmonize your divine masculine and feminine energies, paving the way to spiritual enlightenment.\n\n✨ Unlock the power of crystals\n✨ Harness the energy of essential oils\n✨ Engage in transformative energy work\n✨ Embrace the practice of meditation\n\nWith step-by-step instructions and thoughtful guidance, you’ll learn to cultivate inner balance, enhance your well-being, and awaken your spiritual potential.\n\nWhether you’re just starting out or are an experienced practitioner, this guide meets you where you are and empowers you to take the next steps toward enlightenment.\n\n🌿 First step is to follow me & then comment  YES on this post and I will send you the link to download  your free guide now and start your journey today! 🙏💫\n\n#SpiritualAwakening #InnerBalance #SpiritualJourney #Healing #Crystals #EssentialOils #Meditation #EnergyWork #Enlightenment #FreeGuide #PersonalGrowth #SpiritualEnlightenment #energy #spiritualawakening","Crystals, PersonalGrowth, Healing, EssentialOils, Enlightenment, energy, SpiritualAwakening, spiritualawakening, SpiritualJourney, Meditation, EnergyWork, FreeGuide, InnerBalance, SpiritualEnlightenment",
4.jpg,https://scontent-zrh1-1.cdninstagram.com/v/t51.29350-15/447368334_1012870807119592_4470220502971394190_n.jpg?stp=dst-jpg_e35_p1080x1080&_nc_ht=scontent-zrh1-1.cdninstagram.com&_nc_cat=104&_nc_ohc=2dmNgKCLzFQQ7kNvgH3dexM&edm=AA0rjkIBAAAA&ccb=7-5&oh=00_AYDbxMdrZmjwPo740fb1p48hTq4TzbA8vZl2W3CSUh-yDQ&oe=666408A1&_nc_sid=49ed71,We up there now \n\nLight and love \n\nDaniel\n\nHashtags:\n#spiritualjourney #nonduality #higherconsciousness #positivevibes #selfgrowth #positivethinking #innerpeace #gratitude #selflove #manifestingdreams #manifestation #manifest #selfrealization #enlightenment #awakening #lawofattraction #lawofassumption #consciousness #imagination #imaginationcreatesreality #subconsciousmind #spiritualityawake #awareness #awakenedmind #nevillegoddard #manifestationmagic #manifestationcoaching #manifestationtools #lawofone #oneness,"selfrealization, nonduality, consciousness, oneness, enlightenment, lawofattraction, manifestationtools, awakenedmind, manifest, awakening, spiritualityawake, imaginationcreatesreality, positivevibes, manifestationcoaching, nevillegoddard, innerpeace, lawofassumption, awareness, higherconsciousness, subconsciousmind, manifestationmagic, positivethinking, manifestation, selflove, gratitude, selfgrowth, lawofone, spiritualjourney, imagination, manifestingdreams",
5.jpg,https://scontent-zrh1-1.cdninstagram.com/v/t51.29350-15/447641757_1696491424422223_9023855625610935257_n.heic?stp=dst-jpg_e35&_nc_ht=scontent-zrh1-1.cdninstagram.com&_nc_cat=107&_nc_ohc=R3uoQhsZFXQQ7kNvgEF3J3N&edm=AA0rjkIBAAAA&ccb=7-5&oh=00_AYCw6TN_5z4O_-bxB-D3_mD_yXJN2P5AeO7MYlcny3vXwg&oe=6663F445&_nc_sid=49ed71,Yesss 🤣🤣🤣🫶 #namaste #thegreatawakening #spirituality #enlightenment #spreaditlikecorona #wordisbond #twinflame #twinflameunion #wisdom #knowledgeispower #knowyourworth #foreverp #manifestation #tical #wutangclan #tmc #alchemy #spriritualhealing #meditation #energyhealing #vibetribe #spiritualawakening #divineandconquer,"alchemy, spriritualhealing, spreaditlikecorona, enlightenment, divineandconquer, knowyourworth, knowledgeispower, energyhealing, tical, spiritualawakening, namaste, tmc, thegreatawakening, twinflame, wordisbond, meditation, foreverp, manifestation, spirituality, vibetribe, wutangclan, twinflameunion, wisdom",
6.jpg,https://scontent-zrh1-1.cdninstagram.com/v/t51.29350-15/447443698_968052638133421_3145962945983327411_n.webp?stp=dst-jpg_e35&_nc_ht=scontent-zrh1-1.cdninstagram.com&_nc_cat=101&_nc_ohc=WpXwCKFIZJgQ7kNvgGlHlQl&edm=AA0rjkIBAAAA&ccb=7-5&oh=00_AYAQdViRPRXXQsXh5CcnKygxwGIoXu09O2yyWK9XD2Vp-w&oe=6663EB2C&_nc_sid=49ed71,"There is no true spiritual evolution without the Divine Mother. It is through her that we are able to come to a place of stillness and acknowledgement of being. It is through the Divine Mother that we are able to discover and nurture the truth of who we are through physical, embodied experience. Through the experience, we uncover more of who we are as Divine beings, learning and unveiling what may be standing in the way of truly understanding this as the reality. We can take in information, we can accumulate it....it is entertaining. But how are we living? What choices are being made on a regular basis? What are we choosing to embody and express in the world? One of the many gifts of the Divine Mother is that of choice. So it is by allowing her grace to move through us that we are able to see the choice in daily life. And it is by choosing to live in accordance with love that the truth is unveiled to us. \n\nMuch love, \n\nSaiedah 🌹",,
7.jpg,https://scontent-zrh1-1.cdninstagram.com/v/t51.29350-15/447641753_1586775175439182_5874596650374196470_n.jpg?stp=dst-jpg_e35_s1080x1080&_nc_ht=scontent-zrh1-1.cdninstagram.com&_nc_cat=110&_nc_ohc=xZ2R-WVbe68Q7kNvgH7-0JN&edm=AA0rjkIBAAAA&ccb=7-5&oh=00_AYDm-OWfHgwOb3gIfthFE7Dgt_9tp7iXGaD1FpU3yHrBhg&oe=66640E8D&_nc_sid=49ed71,Rules and instructions for $5 card pull special:\n* Send payment to my PayPal. $5 minimum for 5 cards. You can send more for more cards. It’s a $1 per card.\n* DM me proof of payment with your persons name and birthdate. I will then send you pics of your cards via DM \n* This is a self read message card pull. There will be no intuitive summary given\n* PLEASE SEND PAYMENT AS FRIENDS AND FAMILY. Thank you☺️🤍,,
8.jpg,https://scontent-zrh1-1.cdninstagram.com/v/t51.29350-15/447458420_348522588291229_7603131264534718252_n.heic?stp=dst-jpg_e35&_nc_ht=scontent-zrh1-1.cdninstagram.com&_nc_cat=101&_nc_ohc=QuBh67X2FogQ7kNvgEfzyla&edm=AA0rjkIBAAAA&ccb=7-5&oh=00_AYDrdRSLwo23Jc0WrhjdSNWfuwtVMSXnmVZC5JJ0jGlioA&oe=6663F281&_nc_sid=49ed71,Glory be to God and the universe. Got purpose? Got higher power? You got me😍❤️😘 #namaste #thegreatawakening #spirituality #enlightenment #spreaditlikecorona #wordisbond #twinflame #twinflameunion #wisdom #knowledgeispower #knowyourworth #foreverp #manifestation #tical #wutangclan #tmc #alchemy #spriritualhealing #meditation #energyhealing #vibetribe #spiritualawakening #divineandconquer,"alchemy, spriritualhealing, spreaditlikecorona, enlightenment, divineandconquer, knowyourworth, knowledgeispower, energyhealing, tical, spiritualawakening, namaste, tmc, thegreatawakening, twinflame, wordisbond, meditation, foreverp, manifestation, spirituality, vibetribe, wutangclan, twinflameunion, wisdom",
9.jpg,https://scontent-zrh1-1.cdninstagram.com/v/t51.29350-15/446716532_842241394418597_5555075637747696040_n.heic?stp=dst-jpg_e35&_nc_ht=scontent-zrh1-1.cdninstagram.com&_nc_cat=105&_nc_ohc=vC1CN2LW-kQQ7kNvgHvXw3H&edm=AA0rjkIBAAAA&ccb=7-5&oh=00_AYBkD0M9FaDd4Vy2D4PMBSPnPMVl7HmJnNj_6y4v1V0alg&oe=666408B5&_nc_sid=49ed71,"BEYOND ACCEPTING OR REJECTING \n\nThe open path is a matter of working purely with what is, of giving up altogether the fear that something may not work, that something may end in failure. One has to give up the paranoia that one might not fit into situations, that one might be rejected. One purely deals with life as it is.\n\nChögyam Trungpa ""Cutting Through Spiritual Materialism"" \n\nYou do not have to abandon worldly activities in order to attain effortless unconcern. You should know that worldly activities and effortless unconcern are not two different things, but if you keep thinking about rejection and grasping, you make them two.\n\nHuiNeng (the 6th Zen Patriarch), translation by Thomas Cleary, Classics of Buddhism and Zen, Volume 1 \n\nThe next time you lose heart and you can’t bear to experience what you’re feeling, you might recall this instruction: change the way you see it and lean in. Instead of blaming our discomfort on outer circumstances or on our own weakness, we can choose to stay present and awake to our experience, not rejecting it, not grasping it, not buying the stories that we relentlessly tell ourselves. This is priceless advice that addresses the true cause of suffering — yours, mine, and that of all living beings.\n\nPema Chödron, ""Taking the Leap: Freeing Ourselves from Old Habits and Fears""\n\nThe Way is perfect like vast space\nwhere nothing is lacking and nothing is in excess.\nIndeed, it is due to our choosing to accept or reject\nthat we do not see the true nature of things.\nBe serene in the oneness of things\nand such erroneous views will disappear by themselves.\n\nSengcan (Third Zen Patriarch), Trans. Richard B. Clarke \n\nSince everything is but an apparition,\nPerfect in being what it is,\nHaving nothing to do with good and bad,\nAcceptance or rejection,\nYou might as well burst out laughing!\n\nLongchenpa, Glimpse After Glimpse: Daily Reflections on Living and Dying""\n\n#buddha #dharma #sangha #meditation #enlightenment #spirituality #religion #buddhism","dharma, buddha, enlightenment, sangha, religion, meditation, spirituality, buddhism",
10.jpg,https://scontent-zrh1-1.cdninstagram.com/v/t51.2885-15/447506928_900667318745686_8009620542456185802_n.jpg?stp=dst-jpg_e35&_nc_ht=scontent-zrh1-1.cdninstagram.com&_nc_cat=110&_nc_ohc=-6kymCn1PqQQ7kNvgHqFa79&edm=AA0rjkIBAAAA&ccb=7-5&oh=00_AYAuqv4_Rit95gy3N-caKVSyjerXuqXiL7N9NLF8vCm4zw&oe=6663F7A2&_nc_sid=49ed71,#Spiritual #Physical #Growth #Sensation #Emotion #Enlightenment,"Physical, Emotion, Enlightenment, Sensation, Spiritual, Growth",
11.jpg,https://scontent-zrh1-1.cdninstagram.com/v/t51.29350-15/447624016_331219929859864_3063760957669556339_n.webp?stp=dst-jpg_e35&_nc_ht=scontent-zrh1-1.cdninstagram.com&_nc_cat=104&_nc_ohc=kQTcLRlbqjYQ7kNvgEVSJ2O&edm=AA0rjkIBAAAA&ccb=7-5&oh=00_AYAPeVFE-lrJ-OcI3x9huVdwp9i01utbi8F4KLPCflbeQA&oe=66641120&_nc_sid=49ed71,Cause no.. \n\n.\n\n.\n\n.\n\n.\n\n.\n\n#slowrollit #twitterquotes #writersofig #blackcontentcreators #spiritualcommunity #explore #schrijversvaninsta #queenofcups #divination #writtenwords  #enlightenment #mantakchia,"twitterquotes, explore, divination, enlightenment, queenofcups, schrijversvaninsta, writtenwords, writersofig, blackcontentcreators, slowrollit, spiritualcommunity, mantakchia",
12.jpg,https://scontent-zrh1-1.cdninstagram.com/v/t51.29350-15/447737108_768866271997623_3801491805070636426_n.heic?stp=dst-jpg_e35&_nc_ht=scontent-zrh1-1.cdninstagram.com&_nc_cat=103&_nc_ohc=m-CRRMmuxWQQ7kNvgH7Kj3r&edm=AA0rjkIBAAAA&ccb=7-5&oh=00_AYCRTcl38fcx1-VxRnZXAXK27hrHDA9SZI08hpCicp_0KQ&oe=66640821&_nc_sid=49ed71,#meditation #mindfulness #spirituality #yoga #spiritual #healing #spiritualawakening #meditate #consciousness #enlightenment #awakening #chakras #meditationpractice #chakra #zen #lightworker #wisdom #reiki #thirdeye #energy #buddha #lawofattraction #namaste #peace #psychic #meditationspace #osho #crystals #innerpeace #selflove,"consciousness, osho, enlightenment, lawofattraction, spiritual, reiki, thirdeye, awakening, psychic, spiritualawakening, innerpeace, mindfulness, namaste, chakra, buddha, yoga, lightworker, healing, meditate, zen, meditationspace, meditation, spirituality, selflove, chakras, energy, peace, meditationpractice, wisdom, crystals",
13.jpg,https://scontent-zrh1-1.cdninstagram.com/v/t51.2885-15/447443154_981812877073324_6445054767136776283_n.jpg?stp=dst-jpg_e35&_nc_ht=scontent-zrh1-1.cdninstagram.com&_nc_cat=104&_nc_ohc=No0V0TtqldsQ7kNvgGDd-CU&edm=AA0rjkIBAAAA&ccb=7-5&oh=00_AYC-h4Q89-SmA9pTyETYYBvlH64C0h0b2caJX2hFazsBbQ&oe=6664103F&_nc_sid=49ed71,Words by the famous Alan Watts.\n\n#alanwatts #love #enlightenment #art #socrates #marcusaurelius #epictetus #dalailama #spiritualjourney #philosopher #healing #aristotle #friedrichnietzsche #seneca #quotes #dostoevsky #stoicphilosophy #spiritualquotes #virginiawoolf #yoga #richardfeynman #selflove #nisargadatta #psychology #peace #krishnamurti #spiritualityquotes #sorenkierkegaard #acim #ramdassquotes,"alanwatts, socrates, dalailama, enlightenment, epictetus, friedrichnietzsche, krishnamurti, spiritualityquotes, philosopher, psychology, dostoevsky, quotes, virginiawoolf, sorenkierkegaard, spiritualquotes, aristotle, marcusaurelius, ramdassquotes, nisargadatta, art, yoga, healing, stoicphilosophy, acim, selflove, love, spiritualjourney, peace, seneca, richardfeynman",
14.jpg,https://scontent-zrh1-1.cdninstagram.com/v/t51.29350-15/447651194_3640681899507068_6812055659127892748_n.webp?stp=dst-jpg_e35&_nc_ht=scontent-zrh1-1.cdninstagram.com&_nc_cat=108&_nc_ohc=YczHpGl11IIQ7kNvgHZ_AIZ&edm=AA0rjkIBAAAA&ccb=7-5&oh=00_AYDE8TYpLjQs1DgHAwriaXZVaDIHWGYvqLovm-Gt5m3Yog&oe=666410C9&_nc_sid=49ed71,"UDEMY COURSE PROMOTION:\nhttps://www.udemy.com/course/the-hidden-gift/?referralCode=5D87E681521CF92182F1\n\nYouTube Intro Video:\nhttps://youtube.com/shorts/XVUPDU37fKs?si=mUU9TD3BYHVUVYJL \n\n🌟🌟🌟🌟🌟\n\n“The Hidden Gift (Developing Your Full Potential)” \n\nEbook: http://www.amazon.com/dp/B007D58MNW \n\nBook (Soft Cover) - ISBN: 9781726767545 \nhttps://www.amazon.com/dp/172676754X \n\nBook (Hard Cover) - ISBN: 9798831172935\nhttps://www.amazon.com/dp/B0B46X174T\n\n“All through our lives we are conditioned by the people and institutions around us to fit the Status Quo. In order to be accepted by others, we develop masks which conceal the person Who We Really Are and somehow manage to lose ourselves in the busy and frantic process of living! \n\nThe resulting loss of centre brings the feeling of being pulled in all directions by external circumstances, which limits our chances to achieve our true potential. But I believe that every individual has a Hidden Gift, a special talent which makes us unique and which needs to be shared with the world. Finding helps us realize that we really count and that we can really make a difference”\n\n#spirituality #love #meditation #peace #empowerment #compassion #success #lawofattraction #joy #personaldevelopment #emotionalintelligence #love #spiritual #meditation #spiritualawakening #inspiration #peace #consciousness #self-love #healing #life #wisdom #lawofattraction #universe #enlightenment #lightworker #energy #motivation #thirdeye #positivevibrations #soul #quotes #gratitude #faith","consciousness, emotionalintelligence, enlightenment, lawofattraction, personaldevelopment, universe, success, spiritual, positivevibrations, thirdeye, soul, joy, spiritualawakening, quotes, inspiration, faith, lightworker, self, healing, compassion, life, meditation, spirituality, energy, love, motivation, gratitude, empowerment, peace, wisdom",
15.jpg,https://scontent-zrh1-1.cdninstagram.com/v/t51.29350-15/447771642_862113222418477_7936105987737390771_n.webp?stp=dst-jpg_e35&_nc_ht=scontent-zrh1-1.cdninstagram.com&_nc_cat=101&_nc_ohc=V4RKzrckHcsQ7kNvgFtOkYV&edm=AA0rjkIBAAAA&ccb=7-5&oh=00_AYCrqkueZU3CeYQbBT5lVhdMWTWl2Jfy-C4_rG94hzu3Og&oe=6663DD87&_nc_sid=49ed71,"UDEMY COURSE PROMOTION:\nhttps://www.udemy.com/course/the-hidden-gift/?referralCode=5D87E681521CF92182F1\n\nYouTube Intro Video:\nhttps://youtube.com/shorts/XVUPDU37fKs?si=mUU9TD3BYHVUVYJL \n\n🌟🌟🌟🌟🌟\n\n“The Hidden Gift (Developing Your Full Potential)” \n\nEbook: http://www.amazon.com/dp/B007D58MNW \n\nBook (Soft Cover) - ISBN: 9781726767545 \nhttps://www.amazon.com/dp/172676754X \n\nBook (Hard Cover) - ISBN: 9798831172935\nhttps://www.amazon.com/dp/B0B46X174T\n\n“All through our lives we are conditioned by the people and institutions around us to fit the Status Quo. In order to be accepted by others, we develop masks which conceal the person Who We Really Are and somehow manage to lose ourselves in the busy and frantic process of living! \n\nThe resulting loss of centre brings the feeling of being pulled in all directions by external circumstances, which limits our chances to achieve our true potential. But I believe that every individual has a Hidden Gift, a special talent which makes us unique and which needs to be shared with the world. Finding helps us realize that we really count and that we can really make a difference”\n\n#spirituality #love #meditation #peace #empowerment #compassion #success #lawofattraction #joy #personaldevelopment #emotionalintelligence #love #spiritual #meditation #spiritualawakening #inspiration #peace #consciousness #self-love #healing #life #wisdom #lawofattraction #universe #enlightenment #lightworker #energy #motivation #thirdeye #positivevibrations #soul #quotes #gratitude #faith","consciousness, emotionalintelligence, enlightenment, lawofattraction, personaldevelopment, universe, success, spiritual, positivevibrations, thirdeye, soul, joy, spiritualawakening, quotes, inspiration, faith, lightworker, self, healing, compassion, life, meditation, spirituality, energy, love, motivation, gratitude, empowerment, peace, wisdom",
16.jpg,https://scontent-zrh1-1.cdninstagram.com/v/t51.29350-15/447858592_1006002900944632_8623528134003406059_n.jpg?stp=dst-jpg_e35&_nc_ht=scontent-zrh1-1.cdninstagram.com&_nc_cat=104&_nc_ohc=EfJN5qMDiX8Q7kNvgHkEhdT&edm=AA0rjkIBAAAA&ccb=7-5&oh=00_AYBC97yqBe-M60u6wbdfDv96jrfQLzSVIODfmrGL30LKiQ&oe=6663E084&_nc_sid=49ed71,Nights. 6/3/24\n.\n.\n#stars #prose #nightshift #starseverywhere #starstruck #starsigns #starsign #shootingstars #proses #prosepoetry #starscape #cityofstars #risingstars #countyourluckystars #countingstars #iseestars #starsapphire #enlightenment #galaxy #universe #nightscape #poetry #instapoem #star #poems #poem #writing #higherconsciousness #consciousness #lightworker,"consciousness, enlightenment, universe, poems, nightscape, starscape, starstruck, starsigns, poem, iseestars, starseverywhere, writing, stars, starsign, star, higherconsciousness, lightworker, nightshift, countyourluckystars, prose, risingstars, shootingstars, prosepoetry, cityofstars, proses, starsapphire, poetry, countingstars, galaxy, instapoem",
17.jpg,https://scontent-zrh1-1.cdninstagram.com/v/t51.29350-15/447706490_1670306453747147_8699478834636755690_n.jpg?stp=dst-jpg_e35_p1080x1080&_nc_ht=scontent-zrh1-1.cdninstagram.com&_nc_cat=111&_nc_ohc=oN719YmYJZQQ7kNvgFAQSmz&edm=AA0rjkIBAAAA&ccb=7-5&oh=00_AYDvJzaxfiwyIYMpPQGdXoADgf-rgZTeBjaFho98_K5drQ&oe=6663F0DB&_nc_sid=49ed71,Day 4/365\n.\n.\n.\n#manifest #motivate #self love #growth #peace #dailyaffirmations #enlightenment #dailymotivation #spiritualawakening #manifestation #spiritual\n#consciousmind  #influencer #motivater #happylife #happyquotes #happylifestyle #happy #subconsciousmind #mindset #energy #healing #positivity #goodvibes #positivemindset #trending #meditatedaily  #meditation #positiveenergy #positivethinking,"motivater, enlightenment, spiritual, manifest, happylifestyle, happyquotes, mindset, spiritualawakening, trending, happylife, dailymotivation, positivity, goodvibes, consciousmind, happy, subconsciousmind, self, motivate, healing, influencer, growth, positivethinking, positivemindset, dailyaffirmations, meditation, manifestation, positiveenergy, meditatedaily, energy, peace",
18.jpg,https://scontent-zrh1-1.cdninstagram.com/v/t51.29350-15/447272990_1392195231487717_2852034355022330264_n.webp?stp=dst-jpg_e35_p1080x1080&_nc_ht=scontent-zrh1-1.cdninstagram.com&_nc_cat=101&_nc_ohc=1otfsjSeTsUQ7kNvgH2-zRT&edm=AA0rjkIBAAAA&ccb=7-5&oh=00_AYC0T_foo_FCd1DrX7bGrmbwuTrUaQKINE5oz32xp284tg&oe=6663F3F1&_nc_sid=49ed71,❤️‍🔥\n\n❤️‍🔥\n\n. \n\n.\n\n.\n\n.\n\n.\n\n#positivevibes #quoteoftheday #instagram #inspiration #motivationalquotes #motivation #quote #wisdom #inspirationalquotes #viral #soulmates #enlightenment #positivevibes #lovequotes #poetry #explorepage #happiness #selflove #loveyourself #lifestyle #believe #happy #quotestoliveby #mindset #goals #meditation #lifequotes #gym #yoga #mindset #enlightenment #discipline #divinefeminine,"quoteoftheday, enlightenment, motivationalquotes, lifequotes, mindset, divinefeminine, positivevibes, loveyourself, explorepage, inspiration, viral, believe, inspirationalquotes, happy, happiness, yoga, lovequotes, quotestoliveby, goals, quote, instagram, meditation, gym, discipline, selflove, poetry, motivation, soulmates, lifestyle, wisdom",
19.jpg,https://scontent-zrh1-1.cdninstagram.com/v/t51.2885-15/447798833_1006977544266300_488013743999963861_n.jpg?stp=dst-jpg_e35_p1080x1080&_nc_ht=scontent-zrh1-1.cdninstagram.com&_nc_cat=100&_nc_ohc=EpV5CCmUI5gQ7kNvgG8HzV-&edm=AA0rjkIBAAAA&ccb=7-5&oh=00_AYBpLJs3jGQh9VJf76sNqEP5SdD8FAiLBIpaFBuKkxhnSg&oe=6663E92F&_nc_sid=49ed71,"This Father's Day, celebrate Dad with an experience as distinguished as he is, because he’s always been top shelf! 🥃🥃👑 #cardinaldufour⁠\n⁠\n#happyfatherday #distinguished #topshelf #cdf #armagnac #harmony #enlightenment #wonder #drinkresponsibly","distinguished, harmony, wonder, topshelf, enlightenment, cardinaldufour, drinkresponsibly, armagnac, cdf, happyfatherday",
20.jpg,https://scontent-zrh1-1.cdninstagram.com/v/t39.30808-6/444957469_18269991310231137_6362499234154183307_n.jpg?stp=dst-jpg_e35_p1080x1080_sh0.08&_nc_ht=scontent-zrh1-1.cdninstagram.com&_nc_cat=109&_nc_ohc=L1WDTtB_0uQQ7kNvgEwWigy&edm=AA0rjkIAAAAA&ccb=7-5&oh=00_AYDZ9niuCewMVFRsm4B9sH-NBVaTW3jWQMiT19hEuFK3Ng&oe=6663E435&_nc_sid=49ed71,"Grateful to @nashvillevoyager for giving me the chance to share my story. It’s been an incredible journey, and I’m honored to have had the opportunity to inspire others along the way. Here’s to many more adventures ahead!  #NashvilleVoyager #nashville #InnerGrowth #MindfulnessJourney #SoulAwakening #healing #HolisticHealth #SpiritualJourney #SelfDiscovery #Healer #AwakenedSoul #HealingEnergy #coach #TransformationalJourney #SpiritualAwareness #Enlightenment #SelfCareJourney #love #energy #reiki","SelfCareJourney, HolisticHealth, reiki, Healer, MindfulnessJourney, SpiritualAwareness, InnerGrowth, healing, NashvilleVoyager, coach, energy, Enlightenment, nashville, love, TransformationalJourney, SpiritualJourney, SoulAwakening, AwakenedSoul, SelfDiscovery, HealingEnergy",nashvillevoyager
