Filename,URL,Caption,Hashtags,Mentions
375.jpg,https://scontent-zrh1-1.cdninstagram.com/v/t51.29350-15/447572689_1237086393921940_1001727920493757550_n.heic?stp=dst-jpg_e35&_nc_ht=scontent-zrh1-1.cdninstagram.com&_nc_cat=104&_nc_ohc=hDiTpksCDWcQ7kNvgEo0dGO&edm=AA0rjkIBAAAA&ccb=7-5&oh=00_AYDBhi17x7KDP-eLBsQsMQ3Cb6VHB3jZriO_BhRWfQtXcA&oe=6663E9C7&_nc_sid=49ed71,Follow to get more interesting facts and knowledge \n.\n.\n.\n#didyouknow #enlightenment #funfact\n#generalknowledge #knowledgeable #learned #learnlife #sciences #resources #factss #facts!! #factsonfacts #educationiskey #worldfacts #gkfacts #factsoftheday #unknownfacts #knowledgesharing #creepyfacts #knowledgefacts #educationalfun #factsindia #factszone #knowledgeworld #knowledgeispowerful #superfacts #like4like #follow4followback #enlightened_knowledge,"learnlife, factss, knowledgeispowerful, enlightenment, educationiskey, sciences, gkfacts, didyouknow, unknownfacts, enlightened_knowledge, facts, funfact, factsindia, knowledgeworld, knowledgeable, educationalfun, superfacts, like4like, factsonfacts, worldfacts, learned, follow4followback, factsoftheday, knowledgesharing, resources, factszone, generalknowledge, creepyfacts, knowledgefacts",
376.jpg,https://scontent-zrh1-1.cdninstagram.com/v/t51.29350-15/447291948_324476217363125_7528749604121639864_n.jpg?stp=dst-jpg_e35&_nc_ht=scontent-zrh1-1.cdninstagram.com&_nc_cat=105&_nc_ohc=sWVbuagp56kQ7kNvgHXaKIe&edm=AA0rjkIBAAAA&ccb=7-5&oh=00_AYD4bEYtzKMU_GY4LLffVCzR5ZPfoBvK-A0B1TmFuM5U9w&oe=666405C5&_nc_sid=49ed71,Pablo Amaringo Artwork #ayahuasca \n\n#pabloamaringo #peru #peruvian #shaman #art #artwork #visionary #paintings #painting #shamanism #colorful #artist #dmt #psychedelic #psychedelics #sacred #vision #visual #ceremony #medicineman #vibrant #psychedelicart #spirituality #enlightenment #healing #spiritual #sacred #plantmedicine #plantteachers,"plantteachers, enlightenment, spiritual, ayahuasca, artwork, plantmedicine, visionary, peru, artist, paintings, ceremony, shamanism, psychedelicart, colorful, psychedelic, art, shaman, healing, vibrant, peruvian, vision, sacred, painting, medicineman, spirituality, dmt, visual, psychedelics, pabloamaringo",
377.jpg,https://scontent-zrh1-1.cdninstagram.com/v/t39.30808-6/447777737_18015724949460397_1121954119284141738_n.jpg?stp=dst-jpg_e35_p1080x1080_sh0.08&_nc_ht=scontent-zrh1-1.cdninstagram.com&_nc_cat=101&_nc_ohc=k2mfzObwNS0Q7kNvgH6xPHR&edm=AA0rjkIAAAAA&ccb=7-5&oh=00_AYD1_3-yIRm1fTzdi6JZLjnByAGpbqBDO8UE1-hbOjMUwQ&oe=6663F1B7&_nc_sid=49ed71,"☀️ Mediterranean updates ☀️ \n\nIn 2017 when I was at rock bottom all I wanted was my chronic pain, relentless symptoms and diagnosis to be gone.\n\nMy life had become so limited I couldn’t dream big or think big. I couldn’t think outside of the four walls of my room.\n\nMy days were filled with Web MD searches and appointments and scans and tests and there was little time for anything else.\n\nSince finding the mind body approach to healing my life has changed in ways I never imagined. It’s not just healing, as long as I keep using this approach to life my world continues to open up in beautiful and profound ways.\n\nIt doesn’t mean I am invincible or unaffected by life and pain and the suffering of the world, but it does mean I understand myself, my gifts, my purpose and how I can show up day to day for change.\n\nIf you are interested to know more about these tools go to the 🔗link in my BIO👆 and register now for my LIVE webinar \n\n🔥GET YOUR LIFE BACK FOR SUNMER 2024🔥\n\nWednesday 5th June \n\n#selflove #healingenergy #lightworker #spiritjunkie #meditating #chronicillness #chronicillnesswarrior #lupus #chronicillnessmemes #lupuswarrior #pain #sickpost #endometriosisawareness #crps #rheumatoidarthritis #gastroparesis #autoimmunedisease #ibs #chronsdisease #enlightenment #higherconsciousness #spiritualgrowth #chakras #healing #manifestation #highervibrations #meditation #healingcrystals #thirdeyeopen #thoughtoftheday","gastroparesis, crps, enlightenment, chronicillnessmemes, pain, lupus, thoughtoftheday, endometriosisawareness, thirdeyeopen, lupuswarrior, rheumatoidarthritis, chronicillnesswarrior, healingenergy, healingcrystals, chronicillness, sickpost, spiritualgrowth, higherconsciousness, lightworker, meditating, healing, autoimmunedisease, spiritjunkie, meditation, manifestation, selflove, ibs, chakras, highervibrations, chronsdisease",
378.jpg,https://scontent-zrh1-1.cdninstagram.com/v/t51.29350-15/447379954_1173003270499853_4588367797042294003_n.jpg?stp=dst-jpg_e35_s1080x1080&_nc_ht=scontent-zrh1-1.cdninstagram.com&_nc_cat=105&_nc_ohc=q2ZKAyCn9IkQ7kNvgFAMp10&edm=AA0rjkIBAAAA&ccb=7-5&oh=00_AYDHXGjEowRKeEBtLduYN82i8vkj7zlVRsPS_bc6VwGrTA&oe=6663ECA7&_nc_sid=49ed71,"• \nMorals and Dogma: Annotated\nAlbert Pike\nEditors: Arturo de Hoyas, 33, G.C., Grand Archivist and Grand Historian, with Contributions and Glossary by Rex R. Hutchens, 33, G.C., Past Grand Master, Foward by Ronald A. Seale, 33, G.C., Soverign Grand Commander\nScottish Rite Research Society\nSecond Edition, Supreme Council, 33°, S.J. U.S.A.\nWashington, D.C. • 2016\n\n----\n\nBook is in New Unread condition. Custom bound in full leather with hand marbled endpapers and three sewn in ribbon markers.\n\n— First published from 1872 to 1969, ""Morals and Dogma"" is one of the most insightful works ever prepared for Freemasonry. It is a collection of thirty-two essays which provide a rationale for the Scottish Rite degrees. It encompasses a study of Freemasonry, wise philosophy, ancient mysteries, mythology, ritual, and religion. It serves the useful purpose of putting Masonic morality and ethics within the context of the general society, and bids man to think large--to cast aside the petty concerns of everyday life and to improve ourselves.\n— This new edition includes the complete original text, but has been fully updated and improved. Spelling errors have been corrected, and it is set in clear, easy-to-read type; it retains the original pagination within the body of the text, while new subject headings and paragraph numbers make finding passages easy!\n— Approximately 4,000 notes reveal the original sources used by Pike, clarify passages, suggest further reading, and include cross-references. New ""ready references"" reveal scriptural sources.\n—Profusely illustrated with many images from the original sources Pike had before him when he prepared the original edition.\n— New glossary, with primary and secondary bibliographies, and a new index.\n\n$650\n\n----\n#MoralsandDogma #ScottishRite #Freemasonry #AlbertPike #SecretSociety #Fraternity #Occultbooks #Esotericbooks #Rarebooks #Mythology #Symbolism #FineBinding #AncientWisdom #Enlightenment","MoralsandDogma, Symbolism, Freemasonry, SecretSociety, ScottishRite, Enlightenment, AlbertPike, Esotericbooks, Occultbooks, AncientWisdom, Mythology, Fraternity, Rarebooks, FineBinding",
379.jpg,https://scontent-zrh1-1.cdninstagram.com/v/t39.30808-6/441190462_849777483831608_2996805551300678877_n.jpg?stp=dst-jpg_e15&_nc_ht=scontent-zrh1-1.cdninstagram.com&_nc_cat=108&_nc_ohc=lG-j1Ddo0fAQ7kNvgHK6VGl&edm=AA0rjkIAAAAA&ccb=7-5&oh=00_AYCeuXBzAevyOR5sKOsfvBNsCJStdlEw-HBeJOYOQGpxIg&oe=6663EB39&_nc_sid=49ed71,❤️❤️❤️today best post pulak sagar ji maharaj\n#PulakSagarJiMaharaj #TodayBestPost #SpiritualWisdom #Enlightenment #DivineTeachings #SpiritualGuru,"Enlightenment, SpiritualGuru, SpiritualWisdom, DivineTeachings, TodayBestPost, PulakSagarJiMaharaj",
380.jpg,https://scontent-zrh1-1.cdninstagram.com/v/t39.30808-6/447573658_436205982498908_2334039122138690047_n.jpg?stp=dst-jpg_e35_s1080x1080_sh0.08&_nc_ht=scontent-zrh1-1.cdninstagram.com&_nc_cat=108&_nc_ohc=8AmFVhGr_OgQ7kNvgFBIKZv&edm=AA0rjkIAAAAA&ccb=7-5&oh=00_AYB1Vwx7dXHIXLmE7ciLkVRy2jGdnMCYAWM-5kz07B-2jA&oe=6663E14E&_nc_sid=49ed71,"🌟 Ready to elevate your consciousness? Join us at the Spiritual Growth Forum from June 3-14! With live video presentations from over 25 speakers, it's the perfect opportunity to deepen your spiritual practice. \n\nSo join us and me specifically on Wed 5 June 10am Auckland time by reserving your spot for FREE: www.facebook.com/groups/spiritualgrowthforum/\n\n#ElevateConsciousness #FreeEvent #souljourney #oneness #harmony #lifeforce #energyhealer #intuition #akashicrecords #soulrealignment #coaching #inspiration #universallaw #transformation  #peace #abundance #freedom #joy #loveyourselffirst #forgiveness #spiritualgrowth #consciousness #enlightenment #divinity #quantumhealing  #selfrealisation #lightworker #newzealand","souljourney, oneness, consciousness, freedom, enlightenment, divinity, universallaw, quantumhealing, akashicrecords, transformation, newzealand, harmony, coaching, energyhealer, joy, FreeEvent, inspiration, selfrealisation, spiritualgrowth, ElevateConsciousness, lightworker, loveyourselffirst, intuition, soulrealignment, abundance, peace, lifeforce, forgiveness",
381.jpg,https://scontent-zrh1-1.cdninstagram.com/v/t51.29350-15/447368786_258074890696586_2586181964281537602_n.jpg?stp=dst-jpg_e35&_nc_ht=scontent-zrh1-1.cdninstagram.com&_nc_cat=102&_nc_ohc=Py6QdQVcNS8Q7kNvgER7WPo&edm=AA0rjkIBAAAA&ccb=7-5&oh=00_AYCGIi_sXv-sgP64xgY6zD_y2a6-6tQFDfhHQdNVFIiZwg&oe=6663F3FB&_nc_sid=49ed71,Todays energies 💕\n\n#Positivity #grateful #blessed #thankyou #thankful #loveislove #loveyourself #proud #buisnesswoman #numerology #numerologymeaning #angelnumbers #lawofattraction #manifestation #enlightenment #newperspectives #interesting #1111 #2222 #333 #444 #555 #666 #777 #888 #999 #positivity #love #heal #healing,"numerologymeaning, 1111, 777, numerology, enlightenment, lawofattraction, Positivity, buisnesswoman, 666, 999, 888, interesting, thankful, loveyourself, 333, angelnumbers, newperspectives, positivity, heal, 555, 2222, healing, 444, manifestation, loveislove, blessed, love, proud, thankyou, grateful",
382.jpg,https://scontent-zrh1-1.cdninstagram.com/v/t51.29350-15/447733151_831361012390126_1335608172274863647_n.webp?stp=dst-jpg_e35&_nc_ht=scontent-zrh1-1.cdninstagram.com&_nc_cat=110&_nc_ohc=bC3CcnAobDAQ7kNvgEKo-iB&edm=AA0rjkIBAAAA&ccb=7-5&oh=00_AYCQR9dChz3jDHUV63p2tXFcMrjdZNeBiQY3Xl39qT_RTw&oe=6663F61D&_nc_sid=49ed71,It's your responsibility to be happy 🙂🙂\n\n#quote #quotestoliveby #quotesdaily #quotestagram #quoteoftheday #quotes #enlightenment,"quoteoftheday, quotestagram, enlightenment, quotes, quotestoliveby, quotesdaily, quote",
383.jpg,https://scontent-zrh1-1.cdninstagram.com/v/t51.29350-15/447582135_420509654227182_6243216632136209370_n.webp?stp=dst-jpg_e35&_nc_ht=scontent-zrh1-1.cdninstagram.com&_nc_cat=106&_nc_ohc=xY8gIa2X594Q7kNvgFCVcIM&edm=AA0rjkIBAAAA&ccb=7-5&oh=00_AYCZ9m_CZBu2_qKrfhe_ULYx1DHAE6_klMmLr9iiFTcolQ&oe=6663FBB9&_nc_sid=49ed71,Intimacy\n\n#enlightenment \n#intimacy,"enlightenment, intimacy",
384.jpg,https://scontent-zrh1-1.cdninstagram.com/v/t51.29350-15/447620350_321476320999578_5541560801480831083_n.webp?stp=dst-jpg_e35_s1080x1080&_nc_ht=scontent-zrh1-1.cdninstagram.com&_nc_cat=106&_nc_ohc=JeumlcHpdnwQ7kNvgGD6Beh&edm=AA0rjkIBAAAA&ccb=7-5&oh=00_AYAGarHDp-4_VCWgdKRPQDz4U3nEyN75tNF7VsdzMXGpNA&oe=66640CF0&_nc_sid=49ed71,"""Death is a diamond. For a true practitioner, the significance of death is as valuable as a diamond. Avoiding the issue of death is the greatest self-deception and the greatest superstition.""\n\n—Gyakong Padma Tenzin Rinpoche\n\n#buddha #buddhism #buddhist #dharma #mahayana #mahayanabuddhism #guru #rinpoche #bodhi #enlightenment #tibet #tibetanbuddhism #vajrayana #vajrayanabuddhism #impermanence #buddhistteachings #nyingma #nyingmapa #dzogchen #dzogchenmaster #Bodhicitta","dharma, enlightenment, Bodhicitta, buddhist, mahayana, dzogchen, buddha, tibetanbuddhism, nyingma, nyingmapa, dzogchenmaster, bodhi, vajrayanabuddhism, tibet, vajrayana, mahayanabuddhism, buddhistteachings, rinpoche, guru, buddhism, impermanence",
385.jpg,https://scontent-zrh1-1.cdninstagram.com/v/t39.30808-6/445045941_765049232487360_702872221335422196_n.jpg?stp=dst-jpg_e15_fr_s1080x1080&_nc_ht=scontent-zrh1-1.cdninstagram.com&_nc_cat=100&_nc_ohc=1tbeNliGL2kQ7kNvgGf-Kkt&edm=AA0rjkIAAAAA&ccb=7-5&oh=00_AYCD5shoUnyRB2Ot4OzARQy5VlOBhTr7bxjk60s_P-85gg&oe=6663DB3C&_nc_sid=49ed71,"Wir haben so viel über die Schätze des Ösel Nyingtig erzählt. Jetzt ist es uns wichtig noch einmal zu sagen:\n\nAlle sind willkommen! Wir laden euch herzlich ein, den Segen des Dakini Ngöndro zu erhalten. \n\n""Wenn du dich auf diesen Pfad begibst, mach dich bereit, denn dies ist eine Reise in das Herz von Weisheit und Glückseligkeit.""\n~Tulku Ösel Dorje\n\nKomm mit auf die Reise!\n\nDakini Ngöndro\nmit Tulku Ösel Dorje\n26. bis 29. September 2024\nTibethaus Frankfurt\n\nMehr Info und Anmeldung\nbit.ly/dakini_ngondro\n\nMelde dich gerne, wenn du Fragen hast:\nretreat@taramandala-sangha.de\n\nWir wollen allen die Teilnahme ermöglichen, die das möchten. Wenn du gerade den Normalpreis nicht zahlen kannst, hast du einen ermäßigten Preis/Mitgliederpreis zur Wahl. Wenn du weitere Unterstützung benötigst, wende dich bitte an: \nretreatsponsoring@taramandala-sangha.de\n\nWir haben auch eine Liste mit günstigen Übernachtungsmöglichkeiten in Frankfurt.\n\nWir freuen uns auf dich! \n\n----------------------------- \n\nWe have been said so much about the treasures of the Ösel Nyingtig. Now we just want to tell you:\n\nAll are welcome! We warmly invite everyone to receive the blessings of the Dakini Ngöndro.\n\n""If you embark on this path, get ready, because this a journey into the heart of wisdom and bliss.""\n~Tulku Ösel Dorje\n\nCome along on the journey!\n\nDakini Ngöndro\nwith Tulku Ösel Dorje\nSeptember 26 to 29, 2024\nTibethaus Frankfurt \nGermany\n\nInfo and registration\nbit.ly/dakini_ngondro\n\nPlease contact us if you have questions:\nretreat@taramandala-sangha.de\n\nWe intend to enable everyone who wants to attend this retreat! If you need to, you can select a reduced price. In case you need further support, please contact: \nretreatsponsoring@taramandala-sangha.de\n\nWe also have a list of affordable accommodation options in Frankfurt.\n\n#dakiningondro #oselnyingtig #retreat #blessings #bliss #allarewelcome #retreatdiscount #dakini #khandro #ngondro #tulkuoseldorje #tulkuosel #yeshetsogyal #dzogchen #greatperfection #lamatsultrimallione #adzom #adzomlineage #adzomdrukpa #oselnyingtig #terma #tertön #tibetanbuddhism #enlightenment #meditation #femininewisdom #nyingma #nyingtig #bodhisattva #taramandala #natureofmind","lamatsultrimallione, retreat, enlightenment, adzom, terma, dakini, greatperfection, blessings, tert, femininewisdom, adzomdrukpa, allarewelcome, yeshetsogyal, tulkuoseldorje, nyingtig, oselnyingtig, bliss, dzogchen, tibetanbuddhism, nyingma, khandro, ngondro, retreatdiscount, natureofmind, taramandala, meditation, dakiningondro, tulkuosel, bodhisattva, adzomlineage",taramandala
386.jpg,https://scontent-zrh1-1.cdninstagram.com/v/t51.29350-15/447721524_315734794803741_582179658632843901_n.webp?stp=dst-jpg_e35&_nc_ht=scontent-zrh1-1.cdninstagram.com&_nc_cat=109&_nc_ohc=9z19gOBl-KYQ7kNvgFyRyqg&edm=AA0rjkIBAAAA&ccb=7-5&oh=00_AYB2SFACSR4LdhWjyl-Hy36gvUVKtC5Zzd95zSQxWAfcAw&oe=6663E260&_nc_sid=49ed71,"Take notes.\n.\n.\n#selflove #love #gratitude #knowthyself #higherconsciousness\n#enlightenment #awareness #vibratehigher #selfcare #inspiration\n#spiritualawakening #wisdom #consciousness #trust #iamworthy\n#joy #gaia #stepnicely5 #knowledgeofself #newbegginings\n#knowyourworth #life #wakeup #spiritual #intuition #openyoureyes\n#universe #unity #empath #mindset","consciousness, vibratehigher, empath, enlightenment, universe, knowyourworth, spiritual, knowthyself, knowledgeofself, mindset, spiritualawakening, joy, inspiration, openyoureyes, newbegginings, awareness, stepnicely5, higherconsciousness, unity, life, wakeup, intuition, selflove, trust, love, gratitude, iamworthy, selfcare, wisdom, gaia",
387.jpg,https://scontent-zrh1-1.cdninstagram.com/v/t39.30808-6/444770057_347508178354402_8925162200515336308_n.jpg?stp=dst-jpg_e35_p1080x1080_sh0.08&_nc_ht=scontent-zrh1-1.cdninstagram.com&_nc_cat=110&_nc_ohc=mJL-tPeiaiwQ7kNvgGgKqkk&edm=AA0rjkIAAAAA&ccb=7-5&oh=00_AYBNCzEDPj3BFR2Pn6UFSFkLkIydMbpjMdAq5Ux_TXin0A&oe=6663E681&_nc_sid=49ed71,"Happy Monday! Here's today's channeled message from Spirit. ""God’s wisdom, universal wisdom, can truly be found within. Open yourself up to the teachings and communications from the Holy Spirit within and you will find what you seek. Trust and have faith. You are loved always and so it is."" Type yes to confirm.\n\n#MessageFromSpirit, #SpiritWithin, #GodWithin, #Love, #Peace, #Wisdom, #Enlightenment, #EnergyHealing, #WeAreOne, #WeAreasOnellc, #TurtleLake #RiceLake, #EauClaire, #WI","WeAreOne, Peace, WeAreasOnellc, WI, Love, Enlightenment, TurtleLake, MessageFromSpirit, EnergyHealing, Wisdom, GodWithin, EauClaire, RiceLake, SpiritWithin",
388.jpg,https://scontent-zrh1-1.cdninstagram.com/v/t51.29350-15/447292446_333182156302100_2984262487393401931_n.jpg?stp=dst-jpg_e15&_nc_ht=scontent-zrh1-1.cdninstagram.com&_nc_cat=108&_nc_ohc=tBEZXKQxXKcQ7kNvgHUPpBn&edm=AA0rjkIBAAAA&ccb=7-5&oh=00_AYACu5tlFiak4pFbY_XY5IC8U4m-Zkmm-WvAmmfYaxbjxg&oe=66600EA2&_nc_sid=49ed71,I don’t chase.  I won’t even ask you why. I don’t know and I don’t care to know why people don’t communicate like I do so I can’t expect me in another person lol…… But I’ll tell you one thing that my third 👁️ always show me. Every last mf that comes in my life that shows their ass ends up getting their ass whooped by karma.  Like bro if I tell you what’s in my request box that I leave unread cause you won’t get a personal response from me ITS CRAZY…. Idk how women chase a man it should be a crime honestly 😂 I guess that’s why most men are intimidated by me and that’s why they can’t hang. I will never chase I will never blow you up. It took one experience to awaken my true self to never go back to that sheep weak energy…. I chased a man to the ends of the earth for 8 years and he chased me. Once I realized who tf I was wheeewwwwwww!!!!!! The realization was like being on 🍄 for the first time shit was like a trip…. Ask me where that man is right now 😃 in jail and ask me what happened to the others 😃…. But anyways yall be safe.  This is for all the women taking their power back #knowwhoyouare #ownthatshit #tedtalk #3amthoughts  #geminishit 🤷🏽‍♀️#enlightenment,"tedtalk, 3amthoughts, ownthatshit, knowwhoyouare, enlightenment, geminishit",
389.jpg,https://scontent-zrh1-1.cdninstagram.com/v/t51.29350-15/447527258_1825144801305004_1002069319595992082_n.jpg?stp=dst-jpg_e35&_nc_ht=scontent-zrh1-1.cdninstagram.com&_nc_cat=104&_nc_ohc=P-4jk3UZS88Q7kNvgFUpgd8&edm=AA0rjkIBAAAA&ccb=7-5&oh=00_AYDWk8Mr0M8FXhg5wYjS-UWkV61dxn0eGraIKtnFYomjww&oe=666406C0&_nc_sid=49ed71,Yesss 🙌🙌🙌\n\n#monday #mondaymotivation #mondaymood #motivationmonday #mondays #newweek #newgoals #newenergy #fresh #freshstart #enlightenment #happiness #dreams #aspirations #motivationalquotes #motivation #goodenergy #positivemindset #positivity #createeveryday #youarethecreator #starseed #5d #spirituality #spiritualawareness #raiseyourvibration #justdoit #goaldigger #goalsetting #intentions,"starseed, newgoals, aspirations, enlightenment, motivationalquotes, goodenergy, youarethecreator, goalsetting, spiritualawareness, 5d, mondays, monday, positivity, happiness, motivationmonday, mondaymotivation, newweek, positivemindset, spirituality, createeveryday, fresh, dreams, newenergy, freshstart, justdoit, motivation, raiseyourvibration, mondaymood, goaldigger, intentions",
390.jpg,https://scontent-zrh1-1.cdninstagram.com/v/t51.29350-15/447236014_400245896330302_1997922982895178762_n.webp?stp=dst-jpg_e35_p1080x1080&_nc_ht=scontent-zrh1-1.cdninstagram.com&_nc_cat=110&_nc_ohc=Z-CtjA0RSd4Q7kNvgHbrQbv&edm=AA0rjkIBAAAA&ccb=7-5&oh=00_AYDBggaubVGfEaDFJ6xKvS_46cmvsPC0uraF3krWqGiQPA&oe=6663E2B3&_nc_sid=49ed71,About mirror neurons: Mirror neurons represent a distinctive class of neurons that discharge both when an individual executes a motor act and when he observes another individual performing the same or a similar motor act. These neurons were first discovered in a monkey's brain.\n\n#manifestation #instagram #like #followforfollowback #ascension #enlightenment #alignment #gratitude #youbecomewhatyoubelieve #everyoneisyoupushedout #universehasyourback #divineguidance #soulmission #numerology #epigenetics #energetics #awareness #higherself #love #peace #joy,"everyoneisyoupushedout, like, numerology, soulmission, enlightenment, youbecomewhatyoubelieve, divineguidance, energetics, higherself, joy, epigenetics, awareness, universehasyourback, instagram, manifestation, followforfollowback, love, gratitude, ascension, alignment, peace",
391.jpg,https://scontent-zrh1-1.cdninstagram.com/v/t51.29350-15/447543854_485885823774290_4696186458116178590_n.heic?stp=dst-jpg_e35&_nc_ht=scontent-zrh1-1.cdninstagram.com&_nc_cat=102&_nc_ohc=JV_jgSRf0F8Q7kNvgFbDxOT&edm=AA0rjkIBAAAA&ccb=7-5&oh=00_AYDyI8zBNZy8e6pjF_uRJQZnbyAs4k0b2ws5llLowmvujA&oe=6663F123&_nc_sid=49ed71,"Tsiu Marpo, known as a Dharma Protector (Sanskrit: Dharmapala), is an ancient Buddhist deity whose origins trace back over a thousand years. His story is closely linked with the legendary Padmasambhava, also known as Guru Rinpoche, and the introduction of Buddhism to Tibet. Tsiu Marpo’s narrative intertwines with the efforts of great historical figures to establish and proliferate Buddhism in the region.\n\nhttps://tinyurl.com/29v2vzbz\n\n#buddhistart #tibetanthangka #meditationart #dharmaart #tibetanbuddhism #buddhistsymbolism #mandala #enlightenment #mindfulness #tantra #vajrayana #tibetanculture #buddhistmeditation #sacredsymbols #spiritualpath","mindfulness, vajrayana, tibetanculture, sacredsymbols, buddhistsymbolism, tibetanbuddhism, enlightenment, mandala, tibetanthangka, spiritualpath, tantra, dharmaart, buddhistart, meditationart, buddhistmeditation",
392.jpg,https://scontent-zrh1-1.cdninstagram.com/v/t39.30808-6/441578532_996670435357766_7995809270659823178_n.jpg?stp=dst-jpg_e15_fr_p1080x1080&_nc_ht=scontent-zrh1-1.cdninstagram.com&_nc_cat=102&_nc_ohc=TQa6dccSgyEQ7kNvgH6zkZ3&edm=AA0rjkIAAAAA&ccb=7-5&oh=00_AYCQfAxttzPsbuxj36AjYEtq4KG9qolqh3UBPTHp8N-w-w&oe=6663ED76&_nc_sid=49ed71,#swamisivananda #swamisivanandaquotes #swamisivanandasaraswati #divinelifesociety #spiritualquotes #advaitavedanta #advaita #vedanta #vedantalife #vedantaphilosophy #vedantaquotes #godrealization #satchitananda #rajayoga #upanishads #upanishadstudy #upanishadswisdom #universalconsciousness #enlightenment #spiritualawakening #guru #hinduism #meditation #meditationquotes #yoga #spiritualbee,"satchitananda, enlightenment, godrealization, divinelifesociety, swamisivananda, upanishadstudy, swamisivanandasaraswati, universalconsciousness, spiritualawakening, meditationquotes, spiritualquotes, vedantalife, vedanta, advaitavedanta, swamisivanandaquotes, yoga, advaita, vedantaphilosophy, upanishadswisdom, vedantaquotes, meditation, spiritualbee, upanishads, rajayoga, hinduism, guru",
393.jpg,https://scontent-zrh1-1.cdninstagram.com/v/t51.29350-15/447104113_1231120574931156_2676845714323573951_n.heic?stp=dst-jpg_e35&_nc_ht=scontent-zrh1-1.cdninstagram.com&_nc_cat=100&_nc_ohc=JF3qb_aFErEQ7kNvgGOV9X8&edm=AA0rjkIBAAAA&ccb=7-5&oh=00_AYBAWrOcnk_sVgfRQAymlUoxpMW3dQctPsMX4RtYEgaUPQ&oe=6663FB68&_nc_sid=49ed71,"""Now until the dualistic identity mind \n\nmelts and dissolves, \n\nit may seem that we are parting. \n\nPlease be happy. \n\nWhen you understand the dualistic mind, \n\nthere will be no separation from me. \n\nMay my good wishes fill the sky."" \n\n~ Yeshe Tsogyal\n\nSource 🙏 Erik Jensen 🌷",,
