Filename,URL,Caption,Hashtags,Mentions
244.jpg,https://scontent-zrh1-1.cdninstagram.com/v/t39.30808-6/447701579_17947424969802101_7160655300005624306_n.jpg?stp=dst-jpg_e35_p1080x1080_sh0.08&_nc_ht=scontent-zrh1-1.cdninstagram.com&_nc_cat=105&_nc_ohc=Uxo5USIlGF8Q7kNvgH9Nxfb&edm=AA0rjkIAAAAA&ccb=7-5&oh=00_AYAnEwv4qeYhgIUesqPtXOXeFJNBjKE13sMoicPHVZPohQ&oe=6663DD2C&_nc_sid=49ed71,treat yourself \n\nXo \n\n.\n.\n.\n.\n.\n.\n.\n.\n.\n.\n.\n#manifestations #manifestation #manifestationmagic #manifestationcoach #enlightenment #higherconsciousness #intuition #spiritualgrowth #intention #spiritualguidance #lifepurpose #highervibration #higherawareness #manifestyourlife #travel #travelphotography #traveling #nature #landscape #wanderlust #travelpassion #believe #faith #truth #hope #peace #grateful #healing #meditation #writerstag,"hope, travel, enlightenment, manifestations, truth, travelphotography, landscape, manifestationcoach, spiritualguidance, lifepurpose, faith, wanderlust, believe, spiritualgrowth, higherconsciousness, healing, manifestationmagic, highervibration, writerstag, meditation, manifestation, intuition, manifestyourlife, travelpassion, higherawareness, intention, traveling, peace, grateful, nature",
245.jpg,https://scontent-zrh1-1.cdninstagram.com/v/t39.30808-6/447728320_477173264889560_3423491613885756072_n.jpg?stp=dst-jpg_e15&_nc_ht=scontent-zrh1-1.cdninstagram.com&_nc_cat=108&_nc_ohc=f-T0ZQWM_zkQ7kNvgHa3jTQ&edm=AA0rjkIAAAAA&ccb=7-5&oh=00_AYDa5f_7MghD3fYwaARNRuwXRzwx0oyxobhBNl0EvzFW-Q&oe=6663F67B&_nc_sid=49ed71,Art by Mozart\n\n#witch #somoteitbe🌛🌕🌜 #evileye #enlightenment #witchessupply #witchlife #witchesofig #witchessupportwitches #blessedbe #witchessupport #manifestation #witchessupportingwitches #goddessenergy #abundance #prosperity #goddess #witchessupportingotherwitches #witchyvibes #witchcraft #witchythings #witchesbrew #witchesofinstagram #witchaesthetic #themoon #witches #ukwitch #witcheslife #witchgram #witchesuk #ukwitches,"witches, enlightenment, witch, witchessupportwitches, witchessupportingotherwitches, witchyvibes, evileye, ukwitch, ukwitches, witchessupply, witchcraft, witchesofig, witcheslife, goddess, witchessupportingwitches, goddessenergy, manifestation, witchessupport, witchesofinstagram, themoon, blessedbe, witchaesthetic, somoteitbe, witchesbrew, witchlife, prosperity, abundance, witchesuk, witchythings, witchgram",
246.jpg,https://scontent-zrh1-1.cdninstagram.com/v/t51.29350-15/447651099_1151228066025802_2078387433894514065_n.jpg?stp=dst-jpg_e35_s1080x1080&_nc_ht=scontent-zrh1-1.cdninstagram.com&_nc_cat=110&_nc_ohc=z8uaBtn_lcgQ7kNvgESjwTp&edm=AA0rjkIBAAAA&ccb=7-5&oh=00_AYCmeIeUHa9aX_GQiNop_LA1yGEnRlTk2XDVkc53P2nS2w&oe=6663E698&_nc_sid=49ed71,🤝\n.\n.\n.\n.\n.\n#love #light #energy #cosmicconsciousness #cosmicenergy \n#energyhealing #enlightenment #sacredgeometry \n#innerpeace ##resonance #universalconnection #allisone \n#thrive #goldenratio #oneness #lightworker #god #jesus \n#artist #art,"oneness, cosmicconsciousness, enlightenment, universalconnection, sacredgeometry, light, cosmicenergy, energyhealing, artist, thrive, goldenratio, innerpeace, art, lightworker, god, jesus, energy, love, allisone, resonance",
247.jpg,https://scontent-zrh1-1.cdninstagram.com/v/t51.29350-15/447253324_3350380671933091_8888109665545593749_n.webp?stp=dst-jpg_e35&_nc_ht=scontent-zrh1-1.cdninstagram.com&_nc_cat=107&_nc_ohc=i4XPObz7nz0Q7kNvgFKYl8L&edm=AA0rjkIBAAAA&ccb=7-5&oh=00_AYDwoj-dQlYbmCSP-jK0iAXUA1i7UNCM5EshjURn6vUVCA&oe=66640C3B&_nc_sid=49ed71,"🎧 LISTEN TO THIS BEFORE BED TO MANIFEST WEALTH 💸💸💸\n\nDid you know this Bedtime routine can change your financial destiny? 😱\n\nMaking money is easy?\n\nIf I told you “making money is easy” would you agree?\n\nOr would you feel UNEASY?\n\nThe way you feel about money shapes your reality.\n\nIf you think you need to work HARD, then blessings will be fleeting.\n\nThey’ll come and go without reason.\n\nLuckily you CAN rewrite your destiny.\n\nIn fact, your best life starts with this bedtime routine:\n\nListen to THIS Before Bed To Manifest Wealth While You Sleep.\n\nCheck the link in bio 👇 @spiritualmanifestations to discover this ""switch trick"" changes your financial destiny (free thinkers only)\n👉@spiritualmanifestations\n.\n.\n.\n.\n.\n.\n#crystals #spiritually #energy #wealth #enlightenment #motivation #lawofattraction #inspiration #pinealgland #tarot #mindful #awareness #spiritual #kundalini #selflove #unitedstates #florida #affirmation #healing #consciousness #newyork #manifest #5d #peace","consciousness, enlightenment, lawofattraction, unitedstates, spiritual, manifest, florida, tarot, 5d, pinealgland, inspiration, affirmation, awareness, healing, mindful, newyork, selflove, kundalini, wealth, energy, motivation, peace, crystals, spiritually",spiritualmanifestations
248.jpg,https://scontent-zrh1-1.cdninstagram.com/v/t39.30808-6/444456945_477172681556285_4850763180661855796_n.jpg?stp=dst-jpg_e15&_nc_ht=scontent-zrh1-1.cdninstagram.com&_nc_cat=105&_nc_ohc=5NIxVHbk0ZEQ7kNvgGfCyFq&edm=AA0rjkIAAAAA&ccb=7-5&oh=00_AYC038bDeXoKGpYb-tBszYYpGaZcdvFviW9wTi6pL0lP_g&oe=666406C2&_nc_sid=49ed71,Alexis Rakun\n\n#witch #somoteitbe🌛🌕🌜 #evileye #enlightenment #witchessupply #witchlife #witchesofig #witchessupportwitches #blessedbe #witchessupport #manifestation #witchessupportingwitches #goddessenergy #abundance #prosperity #goddess #witchessupportingotherwitches #witchyvibes #witchcraft #witchythings #witchesbrew #witchesofinstagram #witchaesthetic #themoon #witches #ukwitch #witcheslife #witchgram #witchesuk #ukwitches,"witches, enlightenment, witch, witchessupportwitches, witchessupportingotherwitches, witchyvibes, evileye, ukwitch, ukwitches, witchessupply, witchcraft, witchesofig, witcheslife, goddess, witchessupportingwitches, goddessenergy, manifestation, witchessupport, witchesofinstagram, themoon, blessedbe, witchaesthetic, somoteitbe, witchesbrew, witchlife, prosperity, abundance, witchesuk, witchythings, witchgram",
249.jpg,https://scontent-zrh1-1.cdninstagram.com/v/t39.30808-6/447581509_18283610074207868_4545255154758938380_n.jpg?stp=dst-jpg_e15&_nc_ht=scontent-zrh1-1.cdninstagram.com&_nc_cat=108&_nc_ohc=14lUVFz4Of4Q7kNvgGj1XNz&edm=AA0rjkIAAAAA&ccb=7-5&oh=00_AYD2nqWoKwo2WvkhtYwl1Yy8KqFC8MEBuC1EOLWMAmLhEw&oe=6663F351&_nc_sid=49ed71,"Nithyananda Yoga during Brahmamuhurtha 🔱\nJune 3, 2024\n\nyoga yoga yoga 🧘🏽‍♀️ \n\n“Engaging in Nithyananda Yoga is a powerful way to align your body, mind, and consciousness. Through the practice of asanas, mudras, bandhas, kriyas, and more, you can experience profound transformation and inner awakening. Nithyananda Yoga draws from the rich traditions of Sanatana Hindu Dharma and the Veda-Agamic lineage, offering a holistic approach to physical and spiritual well-being. Embrace this practice with dedication and sincerity to unlock the immense benefits it holds for your overall health and spiritual growth.”\n\n~ Nithyanada GPT by the Avatar @srinithyananda \nhttps://events.ecitizen.info/nithyananda-gpt\n\n🌻Early morning being alive with Yoga is Self Love. \n\nCelebrating Charya pada the greatest gift from Paramashiva! 🧘‍♀️\n\nJoin the #enlightenment #ecosystem for daily Brahma Muhurta routine with Nithyananda #Yoga \n\n108 PVK Sequence\n\n🔱NITHYANANDA YOGA \n\n✨Hosted by KAILASA USA (Los Angeles)\n\n✨FREE for ALL\n\n✨️NO EXPERIENCE NECESSARY \n\n🧘‍♀️YOGA starts at 4:30am pst (daily)\n\nOn zoom \nhttps://ecitizen.kailasamailer.com/join/la-session\n\n#nithyananda #yoga #hindutemple #losangeles #dailyyoga #yogaonline","losangeles, yoga, enlightenment, ecosystem, dailyyoga, nithyananda, yogaonline, hindutemple, Yoga",srinithyananda
250.jpg,https://scontent-zrh1-1.cdninstagram.com/v/t51.29350-15/447506588_787154086929759_320842771753435726_n.webp?stp=dst-jpg_e35&_nc_ht=scontent-zrh1-1.cdninstagram.com&_nc_cat=103&_nc_ohc=DG24oIpaeIwQ7kNvgG7R_rT&edm=AA0rjkIBAAAA&ccb=7-5&oh=00_AYD8UVapYNDVnaqrxBgQ5A-JY7aDOQjmp1YZxRb9-PbAOA&oe=6663DE5D&_nc_sid=49ed71,#om #meditation #quotes #enlightenment #chakra  #nirvana #moksha #zen #anandamayima,"anandamayima, nirvana, chakra, om, enlightenment, quotes, zen, moksha, meditation",
251.jpg,https://scontent-zrh1-1.cdninstagram.com/v/t51.29350-15/447352600_1662295181199852_6491958472077755016_n.webp?stp=dst-jpg_e35&_nc_ht=scontent-zrh1-1.cdninstagram.com&_nc_cat=100&_nc_ohc=PNh5GDtTw-kQ7kNvgFblHsu&edm=AA0rjkIBAAAA&ccb=7-5&oh=00_AYBi94QGIPup-uUoMbRmomkQH4HcY_cPkKkck-r3SY55Aw&oe=6664085B&_nc_sid=49ed71,#navanasociety  #consciousness  #cosmicconsciousness  #nirvana  #navana  #enlightenment  #lifequotes  #lifelessons,"consciousness, cosmicconsciousness, nirvana, enlightenment, navana, navanasociety, lifequotes, lifelessons",
252.jpg,https://scontent-zrh1-1.cdninstagram.com/v/t39.30808-6/442498083_477171971556356_9091715000771992855_n.jpg?stp=dst-jpg_e15&_nc_ht=scontent-zrh1-1.cdninstagram.com&_nc_cat=108&_nc_ohc=awyYSAbzM84Q7kNvgHgfo89&edm=AA0rjkIAAAAA&ccb=7-5&oh=00_AYBor1OOLZ8MBacdRarWuxyGJOVPnDaK8-dwgkiDeAU77A&oe=666404E2&_nc_sid=49ed71,The Morrigan \n\n#witch #somoteitbe🌛🌕🌜 #evileye #enlightenment #witchessupply #witchlife #witchesofig #witchessupportwitches #blessedbe #witchessupport #manifestation #witchessupportingwitches #goddessenergy #abundance #prosperity #goddess #witchessupportingotherwitches #witchyvibes #witchcraft #witchythings #witchesbrew #witchesofinstagram #witchaesthetic #themoon #witches #ukwitch #witcheslife #witchgram #witchesuk #ukwitches,"witches, enlightenment, witch, witchessupportwitches, witchessupportingotherwitches, witchyvibes, evileye, ukwitch, ukwitches, witchessupply, witchcraft, witchesofig, witcheslife, goddess, witchessupportingwitches, goddessenergy, manifestation, witchessupport, witchesofinstagram, themoon, blessedbe, witchaesthetic, somoteitbe, witchesbrew, witchlife, prosperity, abundance, witchesuk, witchythings, witchgram",
253.jpg,https://scontent-zrh1-1.cdninstagram.com/v/t51.29350-15/447468976_1627536278064723_2589849587218863209_n.jpg?stp=dst-jpg_e35&_nc_ht=scontent-zrh1-1.cdninstagram.com&_nc_cat=103&_nc_ohc=yI_w8c_18TMQ7kNvgHPmyTh&edm=AA0rjkIBAAAA&ccb=7-5&oh=00_AYB_yXjzhK7pq30xPvem6myys3VXcswXSGEE3oWTeiAlaQ&oe=6663E268&_nc_sid=49ed71,Monday Musings #selflove #selflovejourney #loveyourself #wisdom #empowerment #enlightenment #positive #positivity #positivevibes #spirituality #spiritual #spiritualawakening #spiritualjourney #spiritualgrowth #inspiration,"selflove, spiritualgrowth, positivevibes, enlightenment, spiritualawakening, loveyourself, empowerment, inspiration, selflovejourney, spiritual, spiritualjourney, positivity, wisdom, positive, spirituality",
254.jpg,https://scontent-zrh1-1.cdninstagram.com/v/t51.2885-15/447313347_1164923887968506_896223350956496546_n.jpg?stp=dst-jpg_e35&_nc_ht=scontent-zrh1-1.cdninstagram.com&_nc_cat=102&_nc_ohc=M4al_K0KlVsQ7kNvgF6uzAr&edm=AA0rjkIBAAAA&ccb=7-5&oh=00_AYDJM9uYeyYBcARbbA9j29Pq0I8E3nAT5A4vGp5Anjh95A&oe=66640891&_nc_sid=49ed71,"Do you feel compelled to search for an unknown ""something?' Have you come to believe that you just haven't found it yet? Like this post if that sounds right for you. ⁠\n⁠\n⁠",,
255.jpg,https://scontent-zrh1-1.cdninstagram.com/v/t39.30808-6/445170689_122114170850316320_2763527277388507605_n.jpg?stp=dst-jpg_e35_p1080x1080_sh0.08&_nc_ht=scontent-zrh1-1.cdninstagram.com&_nc_cat=108&_nc_ohc=iOFB5n3U-qUQ7kNvgF7_qKE&edm=AA0rjkIAAAAA&ccb=7-5&oh=00_AYD-c9mEgEVqh6hn8SX2l_DfxsqIqHX2ZEtJjbZFbjlZeQ&oe=6663F7DB&_nc_sid=49ed71,"No queen. 👸🏽\n\nYou cannot stop now.\n\nYou’re literally about to 🌸BLOOM🌸\n\nTrust yourself & trust the process 🤍\n\nBecause, let’s face it: Not every course can truly reshape your financial prospects using mindset & spirituality. However, there’s Inner Bloom—a standout in the realm of digital marketing courses, crafted by 50+ coaches. This isn’t just learning; it’s a complete transformation poised to impact your life significantly. This is not a course. This is an ACADEMY✨\n\nWith a collection of over 100 hours of carefully curated videos covering topics like social media, marketing, branding, spirituality and beyond, Inner Bloom surpasses the fundamentals. It explores in detail to assist you in crafting a brand that is not only attractive but also engaging, focused on market attraction, effortlessly drawing in your audience.\n\nThe game changer here? It is a WOMEN’S ONLY ACADEMY focused on women’s wellbeing, that being physical, mental & spiritual.\n\nStarting from making a significant impact with your brand launch, dominating your mindset, to excelling in content creation, AI creation—INNER BLOOM is your key to not only earning profits but also igniting a revolution lead by women supporting women.\n\nFeeling that fire yet?💗 IB isn’t just necessary; it’s the rocket fuel propelling you towards being in full controle and financial independence. This course has transformed my path and that of numerous women, propelling us from mere dreamers to action-takers, and from followers to trailblazers.\n\nDon’t miss out on this opportunity to redefine your success and secure your share of the digital market. Make sure this isn’t the chance that slipped away. 🌟\n\nTap into the magic of Inner Bloom. Comment “BLOOM” or hit the link in my bio. The only question left is, are you ready to bloom with us?\n\n@flowfairy.co\n\n #mindset #innerbloom #blooming #growingcommunity #spiritual #enlightenment #bloomtoyourbestself #bloomwithus #womensupportingwomen","mindset, bloomwithus, blooming, enlightenment, womensupportingwomen, innerbloom, growingcommunity, spiritual, bloomtoyourbestself",flowfairy.co
256.jpg,https://scontent-zrh1-1.cdninstagram.com/v/t39.30808-6/447608829_18007229918591261_2328473241305114847_n.jpg?stp=dst-jpg_e15&_nc_ht=scontent-zrh1-1.cdninstagram.com&_nc_cat=105&_nc_ohc=LYN7OdU07lEQ7kNvgEgxkC7&edm=AA0rjkIAAAAA&ccb=7-5&oh=00_AYCnNDr3qslqLHo1e2hdtlklHm59TW8lltZzk62C-9zF4w&oe=6663EBDB&_nc_sid=49ed71,Thank you for your feedback @alignholistichealth. #SpiritualReadings #Enlightenment #spiritualhealer #southernsydneymums#sydneymums \n#stgeorgemums #westernsydneymums #sydneymums  #mumpower_au #easternsuburbsmums #stgeorgearea #theshire  #spiritualsydney #zoom#sydneylocal #sydney #mediumsydney #fullmoon #soundhealing #meditation #mediumship #viral #mediumsydney #workshops #coogee #training #health #wealth,"fullmoon, sydneymums, spiritualhealer, coogee, westernsydneymums, stgeorgearea, mediumship, sydney, easternsuburbsmums, soundhealing, spiritualsydney, southernsydneymums, viral, SpiritualReadings, sydneylocal, training, workshops, meditation, theshire, zoom, mumpower_au, wealth, Enlightenment, health, mediumsydney, stgeorgemums",alignholistichealth
257.jpg,https://scontent-zrh1-1.cdninstagram.com/v/t39.30808-6/447768292_18007229507591261_86146099067991282_n.jpg?stp=dst-jpg_e15&_nc_ht=scontent-zrh1-1.cdninstagram.com&_nc_cat=105&_nc_ohc=AVIhiIkQgkcQ7kNvgEDzmuZ&edm=AA0rjkIAAAAA&ccb=7-5&oh=00_AYCzMBKwvBh7jHqhzEdtCnufA94RUH00gW3-gU7SgfliFQ&oe=6663F62D&_nc_sid=49ed71,"Everything I do is so individual it’s hard to explain. You really have to experience my unique gift to understand, however for everyone who asks me what I do I think this is the best way to describe it.  #SpiritualReadings #Enlightenment #spiritualhealer #southernsydneymums#sydneymums \n#stgeorgemums #westernsydneymums #sydneymums  #mumpower_au #easternsuburbsmums #stgeorgearea #theshire  #spiritualsydney #zoom#sydneylocal #sydney #mediumsydney #fullmoon #soundhealing #meditation #mediumship #viral #mediumsydney #workshops #coogee #training #healthiswealth","fullmoon, sydneymums, spiritualhealer, coogee, westernsydneymums, stgeorgearea, mediumship, sydney, easternsuburbsmums, soundhealing, spiritualsydney, southernsydneymums, viral, SpiritualReadings, sydneylocal, training, workshops, meditation, theshire, zoom, mumpower_au, Enlightenment, healthiswealth, mediumsydney, stgeorgemums",
258.jpg,https://scontent-zrh1-1.cdninstagram.com/v/t51.29350-15/447432773_1678550149345223_7635609361291730706_n.heic?stp=dst-jpg_e35&_nc_ht=scontent-zrh1-1.cdninstagram.com&_nc_cat=111&_nc_ohc=rKI8t87_Qm0Q7kNvgFK1o3t&edm=AA0rjkIBAAAA&ccb=7-5&oh=00_AYCpKeSxOmNAaqcYbgwF0tgbeFPX6hLjCd-n4SjEP4-g_Q&oe=6663F706&_nc_sid=49ed71,"🚨🔗Read the full story at https://therealityregister.com/2024/06/03/who-is-the-stranger-increasingly-frequent-encounters-with-mysterious-being-leaving-witnesses-to-question-its-origins/ 🚨🔗\n\nHave you ever driven down a quiet street at night and seen a mysterious shape in the shadows – tall, aloof, peculiar – and wondered to yourself, “Does that suspicious figure belong here?”, or is that an eerie and otherworldly presence, maybe even a figment of the imagination? If you said yes, you’re not alone. Thousands of people every year report sightings of a creature who has come to be called The Stranger.\n\nCreatures that exist on both sides of the waking world have haunted our imaginations since the dawn of mankind, from stories of will-o-the-wisps lighting up cemeteries in European folklore, to internet phenomenon like the Slenderman who would terrify people by being diabolically out of place and time.\n\nRead the rest of the full story at therealityregister.com \n\n#cryptid #cryptids #supernatural #unexplained #paranormal #hiddentruth #therealityregister #bigfoot #aliens #ufos #ufo #ghosts #afterlife #reality #enlightenment #bitcoins #cryptozoology #history #conspiracy #conspiracytheory #mandelaeffect #multiverse #fringe #science #genesimmons #lurking #stranger","hiddentruth, fringe, enlightenment, paranormal, cryptozoology, lurking, conspiracytheory, mandelaeffect, therealityregister, multiverse, conspiracy, bitcoins, afterlife, cryptids, ufos, cryptid, science, ghosts, stranger, aliens, bigfoot, history, supernatural, unexplained, genesimmons, ufo, reality",
259.jpg,https://scontent-zrh1-1.cdninstagram.com/v/t51.29350-15/447376431_1632026827587190_6367450005251980323_n.webp?stp=dst-jpg_e35&_nc_ht=scontent-zrh1-1.cdninstagram.com&_nc_cat=110&_nc_ohc=UREm704e3FcQ7kNvgGzwm_p&edm=AA0rjkIBAAAA&ccb=7-5&oh=00_AYDeTGP3MMgkusKbv_RFY-MGKVnf_cYn7xJmsRV_5dZIMw&oe=66640A58&_nc_sid=49ed71,Embrace the journey of self-discovery and inner peace. Transform your life with the wisdom of Buddhism and unlock the path to enlightenment. 🌟 Join our community and start your journey today! 🌈\n\nFollow us for more insights and tips on living a mindful and peaceful life! ✨\n\n#Buddhism #Mindfulness #Meditation #SpiritualAwakening #InnerPeace #Enlightenment #SelfDiscovery #MindfulLiving #BuddhistWisdom #SpiritualJourney #PeacefulMind #ZenLife #DailyMeditation #MindfulnessPractice #InnerCalm #BuddhistTeachings #PositiveVibes #MentalWellness #SoulHealing #StayPresent #SpiritualGrowth #Harmony,"SoulHealing, ZenLife, PeacefulMind, InnerCalm, Harmony, MindfulnessPractice, BuddhistTeachings, SpiritualAwakening, Buddhism, BuddhistWisdom, PositiveVibes, MentalWellness, Meditation, DailyMeditation, Mindfulness, InnerPeace, Enlightenment, SpiritualGrowth, SpiritualJourney, StayPresent, SelfDiscovery, MindfulLiving",
260.jpg,https://scontent-zrh1-1.cdninstagram.com/v/t39.30808-6/447502990_18304494898154608_475324876210369242_n.jpg?stp=dst-jpg_e15&_nc_ht=scontent-zrh1-1.cdninstagram.com&_nc_cat=104&_nc_ohc=5Ae7Y1iiodkQ7kNvgGTjCiR&edm=AA0rjkIAAAAA&ccb=7-5&oh=00_AYANv7RGjpEO_IuLiEcdMXQIr1OuvCUZs1mHrSYRXUzYdA&oe=666409CD&_nc_sid=49ed71,Birthday with Padmanabhan 💗\n\n#birthday #padmanabhaswamytemple #bigday #traditional #temple #thiruvananthapuram #sunlight #peace #enlightenment,"birthday, temple, thiruvananthapuram, sunlight, padmanabhaswamytemple, enlightenment, traditional, peace, bigday",
261.jpg,https://scontent-zrh1-1.cdninstagram.com/v/t51.29350-15/447387672_333716162899821_8012027964754770199_n.jpg?stp=dst-jpg_e35&_nc_ht=scontent-zrh1-1.cdninstagram.com&_nc_cat=109&_nc_ohc=7IJUYwn6eqIQ7kNvgHnv3qw&edm=AA0rjkIBAAAA&ccb=7-5&oh=00_AYB_6pjf0lR70v8wQ-Q-P_Qp-TAxNDHOuUcCoYJzCSb6jg&oe=6663EE11&_nc_sid=49ed71,Manifest a life where you don’t dread Mondays… \n\nA life that you don’t feel like you have to escape from…\n\nAnd a life where you have everything you’ve ever wanted. \n\nYour dream life is ready & waiting.\n\nLink in bio 💋🖤,,
262.jpg,https://scontent-zrh1-1.cdninstagram.com/v/t51.29350-15/447475676_432285502905849_7080967325337570616_n.jpg?stp=dst-jpg_e35_s1080x1080&_nc_ht=scontent-zrh1-1.cdninstagram.com&_nc_cat=109&_nc_ohc=te6rADqrylIQ7kNvgE0iSWZ&edm=AA0rjkIBAAAA&ccb=7-5&oh=00_AYCDuhKlttpEkOuyUfdksgl2mKSH527zxl12ljWjEB7MCA&oe=66640BF9&_nc_sid=49ed71,#enlightenment,enlightenment,
263.jpg,https://scontent-zrh1-1.cdninstagram.com/v/t51.2885-15/447764519_422657337406948_9079364701694437363_n.jpg?stp=dst-jpg_e35_s1080x1080&_nc_ht=scontent-zrh1-1.cdninstagram.com&_nc_cat=104&_nc_ohc=iTou0mvFTiMQ7kNvgE3Q7R9&edm=AA0rjkIBAAAA&ccb=7-5&oh=00_AYACvB_VOvE-YgaqcyfjccMPvcE9P9SvUALcJanY7Kn0kw&oe=6663EA4F&_nc_sid=49ed71,"Excerpt and image from ""The Magus: Kundalini and the Golden Dawn"" by Neven Paar, a 590-page 7""x10"" textbook that is ""A Complete System of Magick that Bridges Eastern Spirituality and the Western Mysteries.""\n.\n.\nDEFINITIVE VERSION, OUT NOW!!! Click the link in bio to order your copy. 🔮\n.\n.\n(From Part I-The Qabalah)\n.\n.\n#hermeticism #magick #chakras #tarot #astrology #cosmicconciousness #enlightenment #alchemy #westernmysteries #esoteric #occult #treeoflife #spiritualawakening #ascension #kundalini #meditation #thoth #hermeticprinciples #innerpeace #selfawareness #higherself #mercury #hermestrismegistus #qabalah #mindbodyspirit #ceremonialmagic #cabala #kundaliniyogalife","alchemy, mercury, enlightenment, astrology, hermeticprinciples, kundaliniyogalife, tarot, westernmysteries, cabala, higherself, treeoflife, spiritualawakening, cosmicconciousness, innerpeace, hermeticism, magick, occult, ceremonialmagic, hermestrismegistus, thoth, mindbodyspirit, meditation, kundalini, chakras, qabalah, ascension, esoteric, selfawareness",
264.jpg,https://scontent-zrh1-1.cdninstagram.com/v/t51.29350-15/447637861_431100083029839_8816814267438828955_n.jpg?stp=dst-jpg_e35_s1080x1080&_nc_ht=scontent-zrh1-1.cdninstagram.com&_nc_cat=103&_nc_ohc=cn1i5UYsI54Q7kNvgFAYFeG&edm=AA0rjkIBAAAA&ccb=7-5&oh=00_AYBrC5kq7aP7BD3qYFj4HruDAkUmcRNFRNG42CUcRZNsyg&oe=6663EF22&_nc_sid=49ed71,#enlightenment,enlightenment,
265.jpg,https://scontent-zrh1-1.cdninstagram.com/v/t51.29350-15/447586828_420146847570897_6126292673220564540_n.jpg?stp=dst-jpg_e15_fr_s1080x1080&_nc_ht=scontent-zrh1-1.cdninstagram.com&_nc_cat=109&_nc_ohc=5Bp3iQOeKEIQ7kNvgEcm8D8&edm=AA0rjkIBAAAA&ccb=7-5&oh=00_AYDutq2pDwinFyBVdpbPF0kAKvXm4GQmUel5QWUo9AaMTg&oe=6663F8CF&_nc_sid=49ed71,"[2024年6月2日]\n我皈依了\n皈依佛\n皈依法 \n皈依僧\n\n法名 “耀行”\n\nI have taken refuge\nTaking refuge in the Buddha\nTaking refuge in the Dharma\nTaking refuge in the Sangha\nDharma name: ""Yaoxing""\n2 June 2024\n\n#佛教 \n#真言宗 \n#大日如来 \n#覺悟之道 \n\n#buddhism \n#shingon \n#enlightenment \n#journeyofdiscovery","shingon, enlightenment, journeyofdiscovery, buddhism",
266.jpg,https://scontent-zrh1-1.cdninstagram.com/v/t51.29350-15/447306492_3709031842704931_637168957732143287_n.heic?stp=dst-jpg_e35_p1080x1080&_nc_ht=scontent-zrh1-1.cdninstagram.com&_nc_cat=107&_nc_ohc=C51nH-AMuksQ7kNvgEi2-3H&edm=AA0rjkIBAAAA&ccb=7-5&oh=00_AYBQhZXIlHXTTTUGdy9DconSy7HiAQfM4LMM3GGmLhY_Xg&oe=6663FBC7&_nc_sid=49ed71,First layers done. I call this soul-scaping 🩵🔥 during a meditation through the void I got asked to draw my soul as I seen a blue flame flowing up a waterfall. \nI did these on a whim lastnight I've always got to wait for the paint to dry so I don't smudge or ruin my tools. Lots of details to add and whites and blacks. White marker pens do nott last long. These are all water colours and I'll share the rest on patreon. Huge uploads happening at the moment so don't be a stranger come subscribe and get open availability to chat with me first hand 🫶🏻 I have a really beautiful flame I'm saving to show my supporters only. Today is definitely a work from home day.. come join the story. My Shaman @not_your_average_shaman encouraged this and he did great in doing so. I'm also writing a lot. Over on patreon you'll hear a lot of my inner thoughts and visions. As well as a bit of spice 🌶 \n\n#artist #artoftheday #blueflame #startup #artofinstagram #souldrawing #upload #meditation #beyourownmedicine #awakened #lightenup #enlightenment #souljourney #create #watercolour,"create, souljourney, lightenup, artofinstagram, awakened, artist, enlightenment, blueflame, artoftheday, souldrawing, startup, upload, watercolour, beyourownmedicine, meditation",not_your_average_shaman
