Filename,URL,Caption,Hashtags,Mentions
111.jpg,https://scontent-zrh1-1.cdninstagram.com/v/t51.29350-15/447376436_1169644054066124_699477679658920936_n.heic?stp=dst-jpg_e35&_nc_ht=scontent-zrh1-1.cdninstagram.com&_nc_cat=108&_nc_ohc=koGOzLyxUNsQ7kNvgHP-h_1&edm=AA0rjkIBAAAA&ccb=7-5&oh=00_AYAHaWww7QGYNhsOPFp8hQ9StZm0qhTPvTei7PDEWfeJbw&oe=6663FD78&_nc_sid=49ed71,"@1PsychicLoveExpert is a spiritual advisor. She has the power and the ability to help if you are worried,troubled, confused,she can find your true path in life. I am blessed with a true authentic intuitive gift I received through generations I specialize in energy work and healing in twin flames soulmates and other soul connections.🧿 I not only read twin flame connections with amazing accuracy but I also help twin flames connections cut karmic chords and unbalances that keep relationships from sharing a healthy and unconditionally loving relationship together.🧿 I work with all problems in life reunites lovers \nrebuild broken Relationship. \n🧿I have natural gifts to communicate with angelic energies spirit guides in the universe and through your OWN spirit guides I will be able to reveal insightful and accurate messages they will advise me to share with you during the reading.\n🔴FREE SAMPLE READING \nCall Now \n I also connect through WhatsApp 001-469-476-7284 ☎️\n18+ ONLY 🔞\n\n-\n\n#twinflame #psychic #love #relationships #soulmates #twinflames #psychicreading #tarotreading #1111 #spiritual #spirituality #empath #intuition #indigo #reiki #psychiclovereading #lovespecialist #twinflamereading #twinflamehealing #twinflamereader #lovepsychic #indigo #meditation #yoga #enlightenment #aura #intuition #lightworker #soul #intuition","twinflamereader, aura, 1111, empath, enlightenment, tarotreading, twinflamereading, spiritual, twinflamehealing, reiki, psychic, soul, lovepsychic, indigo, psychicreading, psychiclovereading, yoga, lightworker, twinflame, relationships, meditation, spirituality, twinflames, intuition, lovespecialist, love, soulmates",1PsychicLoveExpert
112.jpg,https://scontent-zrh1-1.cdninstagram.com/v/t51.29350-15/447472782_968481101726731_2004355463481702671_n.heic?stp=dst-jpg_e35&_nc_ht=scontent-zrh1-1.cdninstagram.com&_nc_cat=107&_nc_ohc=36tNCHmSlJ0Q7kNvgFJPA1B&edm=AA0rjkIBAAAA&ccb=7-5&oh=00_AYAO7rw0vF-O6M7_0TtQZQo9PMCmOsOx8TJtOI4qNa9glQ&oe=66640D87&_nc_sid=49ed71,"#youth #renovate #transformation #infinite #unlimited #world #light #divine #blessings #love #self #selftime #opportunity #wisdom #empowerment #enlightenment #life #precious #treasure #powerwithin #positive #serve #soulconnection #reflection #selfreflection #innerlight #content #inspire #vibes #meditation\n\nFor registration, please follow the link:\nhttps://rajayogacenter.org/event/virtue-cafe/","treasure, enlightenment, light, soulconnection, positive, selfreflection, selftime, transformation, vibes, opportunity, serve, precious, reflection, blessings, content, renovate, self, inspire, powerwithin, unlimited, life, infinite, divine, meditation, youth, love, world, empowerment, innerlight, wisdom",
113.jpg,https://scontent-zrh1-1.cdninstagram.com/v/t39.30808-6/444480780_18317736661179067_3236163643006938381_n.jpg?stp=dst-jpg_e35_s1080x1080_sh0.08&_nc_ht=scontent-zrh1-1.cdninstagram.com&_nc_cat=107&_nc_ohc=B7nmVZGNaIgQ7kNvgGoMTV5&edm=AA0rjkIAAAAA&ccb=7-5&oh=00_AYCM32CKVCFflCqzGqpDgOzSUXq2ENbS6twEOtf-nU5gGQ&oe=6663EBA9&_nc_sid=49ed71,"Join us for youth event Navigating Freelancing for Musicians\nSaturday June 8, 2024 at 11:00am EDT\n\nRegister at link in bio or at link below\n\nhttps://register.gotowebinar.com/register/787332128813141084\n\n#musicians #freelancing #srinivasarka #depression #mentalhealth #positiveliving #ccacanada #canadacca #centreforconsciousawareness #lightoflearning #lightoflearningprogramme #centreforconsciousawarenesscanada #mentalhealthawareness #wellness #arkadhyana #dhyana #intuitivemeditation #health #seniors #intuitivemeditation #arkadhyanaintuitivemeditation #millenial #millenials #positivelivingseries #strength #problemsolving #enlightenment #uplifted #universe #selfdevelopment\nwww.coppersunbooks.com www.srinivasarka.org\n @srinivasarkaofficial \n\nThank you to supporters\n@uottawaprepharmclub\n@cupa.concordia\n@nativecentre\n@medgamesorg\n@camskidslu_tbay\n@yorkregionwf\n@thegrovehubs","millenials, centreforconsciousawareness, arkadhyana, enlightenment, universe, centreforconsciousawarenesscan, srinivasarka, problemsolving, positiveliving, selfdevelopment, wellness, dhyana, arkadhyanaintuitivemeditation, mentalhealth, ccacanada, canadacca, positivelivingseries, strength, millenial, lightoflearningprogramme, musicians, freelancing, lightoflearning, mentalhealthawareness, intuitivemeditation, seniors, health, depression, uplifted","yorkregionwf, camskidslu_tbay, cupa.concordia, uottawaprepharmclub, medgamesorg, thegrovehubs, srinivasarkaofficial, nativecentre"
114.jpg,https://scontent-zrh1-1.cdninstagram.com/v/t51.29350-15/447535482_972806177851443_8386240290794917021_n.heic?stp=dst-jpg_e35&_nc_ht=scontent-zrh1-1.cdninstagram.com&_nc_cat=103&_nc_ohc=cdrKhnOROBUQ7kNvgEcuPvc&edm=AA0rjkIBAAAA&ccb=7-5&oh=00_AYD8BCOd6mU1bgs72QVh1Zt1GaKMDTUm4h9BPH-ffQx2aQ&oe=6663E026&_nc_sid=49ed71,"It's #menshealthmonth so let's get into it\n\nThere is talk out there about Black men avoiding healing or desire it.\n\nMost of them don't identify what needs to be healed or what it looks like therefore they don't go for it.\n\nBut listen....once they identify those issues and there's solutions and relief they are long term students of healing so don't count them out.\n\nThat environment of security and comfort is what they desire because most don't get it in society....once they feel it they are locked in\n\nAlso, not being understood as Black men and the situations that they face daily not taken into account causes misdiagnosing which can affect all aspects of their well-being....especially if they are taking meds that don't fit the problems.\n\nFollow @bbweightroom for specialized Black male treatment for mental wellness",menshealthmonth,bbweightroom
115.jpg,https://scontent-zrh1-1.cdninstagram.com/v/t51.2885-15/447782939_1131001624778167_6959144453345841866_n.jpg?stp=dst-jpg_e35_s1080x1080&_nc_ht=scontent-zrh1-1.cdninstagram.com&_nc_cat=107&_nc_ohc=gTitaBL7OA8Q7kNvgHRVa2x&edm=AA0rjkIBAAAA&ccb=7-5&oh=00_AYBxqkd9yaj_crpVI4C_3lfV7rzfgXRq9A6_K36zPSAftg&oe=6663FCFB&_nc_sid=49ed71,"All that is necessary to access our inherent happiness is to go directly into the depths of our being, behind the obscuring layers of thought and feeling. This is the great understanding that everyone should have from an early age. What could be more important in life than to know that we are already that for which we long?\n\n– from ‘You Are the Happiness You Seek’, by Rupert Spira\n\nAvailable at fine bookstores and online: https://rupertspira.com/store/you-are-the-happiness-you-seek\n\n#youarethehappinessyouseek #YATHYS #rupertspira #nonduality #meditation #selfenquiry #awareness #natureofexperience #innerwisdom #enlightenment #consciousness #nondualquotes #zen #innerpeace #poetry #quote #bookquote #rupertspiraquotes","nonduality, consciousness, YATHYS, youarethehappinessyouseek, rupertspira, awareness, natureofexperience, innerwisdom, bookquote, enlightenment, nondualquotes, poetry, innerpeace, zen, rupertspiraquotes, selfenquiry, quote, meditation",
116.jpg,https://scontent-zrh1-1.cdninstagram.com/v/t51.29350-15/447745193_805305394913153_973400166402623810_n.heic?stp=dst-jpg_e35_s1080x1080&_nc_ht=scontent-zrh1-1.cdninstagram.com&_nc_cat=105&_nc_ohc=PlIbZsW127cQ7kNvgE-8-PS&edm=AA0rjkIBAAAA&ccb=7-5&oh=00_AYA8IqPTN-QyXdsUu5MSCoqZhCIFkOF5Yvf11nv8xSq63g&oe=6663FE97&_nc_sid=49ed71,"#kids #blossom #transformation #infinite #unlimited #world #light #divine #blessings #love #self #selftime #opportunity #wisdom #empowerment #enlightenment #life #precious #treasure #powerwithin #positive #serve #soulconnection #reflection #selfreflection #innerlight #content #inspire #vibes\n\nFor registration, please follow the link:\nhttps://rajayogacenter.org/event/enlightened-kids/","treasure, enlightenment, light, soulconnection, positive, blossom, selfreflection, selftime, transformation, vibes, opportunity, serve, precious, reflection, blessings, content, kids, self, inspire, powerwithin, unlimited, life, infinite, divine, love, world, empowerment, innerlight, wisdom",
117.jpg,https://scontent-zrh1-1.cdninstagram.com/v/t51.29350-15/447302063_477363864803905_3402228219392713531_n.jpg?stp=dst-jpg_e35_p1080x1080&_nc_ht=scontent-zrh1-1.cdninstagram.com&_nc_cat=101&_nc_ohc=qrASiFEKj7wQ7kNvgGWcsFr&edm=AA0rjkIBAAAA&ccb=7-5&oh=00_AYCzEEhch4RhCr8TW00g1znof9GQfS2ZL6EAznwvkNM98A&oe=66640CFC&_nc_sid=49ed71,By not seeking contentment\n\nwe are able to appreciate what we already have 💚\n\n📸 :🗽 \n\n#Gratitude #SoulFull #EverythingIsEnergy #Enlightenment #NYC,"EverythingIsEnergy, Enlightenment, NYC, Gratitude, SoulFull",
118.jpg,https://scontent-zrh1-1.cdninstagram.com/v/t51.29350-15/447748324_990087189487636_1327570819537808374_n.jpg?stp=dst-jpg_e35_p1080x1080&_nc_ht=scontent-zrh1-1.cdninstagram.com&_nc_cat=104&_nc_ohc=kxrzif7NbggQ7kNvgHdWsrx&edm=AA0rjkIBAAAA&ccb=7-5&oh=00_AYCpnuq3HFmENDjkfY9P1XVTww11-hXFToKaoB5GYqHUdA&oe=6663E86E&_nc_sid=49ed71,#ledbyprayers #ascension #awakening #higherdimensions #enlightenment,"awakening, enlightenment, ledbyprayers, ascension, higherdimensions",
119.jpg,https://scontent-zrh1-1.cdninstagram.com/v/t39.30808-6/447569301_18438809152056261_6289842630026788566_n.jpg?stp=dst-jpg_e15_fr_s1080x1080&_nc_ht=scontent-zrh1-1.cdninstagram.com&_nc_cat=109&_nc_ohc=R4KDjuW6er8Q7kNvgFrmCND&edm=AA0rjkIAAAAA&ccb=7-5&oh=00_AYBuFEA1MHL5W1TIQfJtt8g_tSdCBy1qN861hVOlUifkjw&oe=6663DFA7&_nc_sid=49ed71,Week of 6/3/24-6/9/24 horoscopes for each rising sign 🔮✨,,
120.jpg,https://scontent-zrh1-1.cdninstagram.com/v/t51.29350-15/447729268_965085781968654_6028471883762566919_n.heic?stp=dst-jpg_e35&_nc_ht=scontent-zrh1-1.cdninstagram.com&_nc_cat=106&_nc_ohc=czvtWDCQ-MEQ7kNvgGcHUOx&edm=AA0rjkIBAAAA&ccb=7-5&oh=00_AYB8oDoRZmFpASYMsUWzyTTXak3wFtAQymphpbi8pbrfbA&oe=6663EB40&_nc_sid=49ed71,"#mind #meditation #mindoverbody #thoughts #infinite #unlimited #world #light #divine #blessings #love #self #selftime #opportunity #wisdom #empowerment #enlightenment #life #precious #treasure #powerwithin #positive #serve #soulconnection #reflection #selfreflection #innerlight #content #inspire #vibes\n\nFor registration, please follow the link:\nhttps://rajayogacenter.org/event/meditation-for-beginners-hindi/","treasure, mind, enlightenment, light, soulconnection, positive, selfreflection, selftime, vibes, opportunity, serve, precious, reflection, blessings, content, self, inspire, powerwithin, unlimited, life, infinite, divine, thoughts, meditation, mindoverbody, love, world, empowerment, innerlight, wisdom",
121.jpg,https://scontent-zrh1-1.cdninstagram.com/v/t51.29350-15/447796396_1512396299687541_94680600593368349_n.jpg?stp=dst-jpg_e15_fr_s1080x1080&_nc_ht=scontent-zrh1-1.cdninstagram.com&_nc_cat=109&_nc_ohc=RDhrqZLRfdEQ7kNvgFs_QPc&edm=AA0rjkIBAAAA&ccb=7-5&oh=00_AYBmA6bWqiINS_FfRhAOsJrPGkVtEaPh_ZydKMzW6fWR3w&oe=6663E3F2&_nc_sid=49ed71,🧿 There’s nothing to hide or change when you’re focused on wholeness. Being whole is simply a matter of being.\n.\n.\n.\n.\n.\n.\n.\n.\n.\n.\n.\n.\n.\n.\n.\n.\n.\n.\n.\n#meditation #love #yoga #selflove #motivation #spirituality #spiritual #wisdom #awakening #lawofattraction #thesecret #life #spirit #loveandlight #instaquotes #wellness #theuniverse #goodvibes #lookwithin #lawofattractionquotes #calm #health #fitness #affirmations #beautiful #higherawakening #lifequotes #enlightenment #thehigherself #guidance,"higherawakening, beautiful, theuniverse, enlightenment, lawofattraction, thehigherself, loveandlight, spiritual, lifequotes, awakening, fitness, wellness, calm, guidance, goodvibes, yoga, instaquotes, thesecret, life, meditation, spirituality, lawofattractionquotes, selflove, spirit, love, health, motivation, affirmations, wisdom, lookwithin",
122.jpg,https://scontent-zrh1-1.cdninstagram.com/v/t39.30808-6/444929123_18226072906287012_3614943163807892515_n.jpg?stp=dst-jpg_e35_s1080x1080_sh0.08&_nc_ht=scontent-zrh1-1.cdninstagram.com&_nc_cat=100&_nc_ohc=wQSySPR0bLoQ7kNvgFMFqnK&edm=AA0rjkIAAAAA&ccb=7-5&oh=00_AYC3bIyMoavvcTCJa3ijt8cEDAUf-Kk8iCRpfUY7J-ONNQ&oe=666408EF&_nc_sid=49ed71,Be clear with your intentions as the Universe is listening!\n\n#souljourney #soul #soulgrowth #spirituality #spiritualawakening #spiritual #intuition #changeyourthoughts #love #spiritualjourney #energy #lawofattraction #energyhealing #innerpeace #raiseyourvibration #energywork #spiritualgrowth #universe #lightworker #allthingsintuitive #higherconsciousness #empath #everythingisenergy #universallaws #growth #innerchild #enlightenment #divinetiming,"souljourney, everythingisenergy, empath, enlightenment, lawofattraction, universe, spiritual, energyhealing, soul, energywork, soulgrowth, spiritualawakening, divinetiming, innerpeace, spiritualgrowth, higherconsciousness, lightworker, growth, innerchild, spirituality, intuition, energy, love, allthingsintuitive, raiseyourvibration, universallaws, spiritualjourney, changeyourthoughts",
123.jpg,https://scontent-zrh1-1.cdninstagram.com/v/t51.29350-15/447766066_435062289318605_2047412727062111228_n.heic?stp=dst-jpg_e35&_nc_ht=scontent-zrh1-1.cdninstagram.com&_nc_cat=105&_nc_ohc=kuFuDGQX1QYQ7kNvgHPGnOL&edm=AA0rjkIBAAAA&ccb=7-5&oh=00_AYDgNL3fGiMtwPMxhZALuiSDoZUdi_A-tKi5vik1IlCykA&oe=6663E411&_nc_sid=49ed71,"#mind #meditation #mindoverbody #thoughts #infinite #unlimited #world #light #divine #blessings #love #self #selftime #opportunity #wisdom #empowerment #enlightenment #life #precious #treasure #powerwithin #positive #serve #soulconnection #reflection #selfreflection #innerlight #content #inspire #vibes\n\nFor registration, please follow the below link:\nhttps://rajayogacenter.org/event/meditation-for-beginners-english/","treasure, mind, enlightenment, light, soulconnection, positive, selfreflection, selftime, vibes, opportunity, serve, precious, reflection, blessings, content, self, inspire, powerwithin, unlimited, life, infinite, divine, thoughts, meditation, mindoverbody, love, world, empowerment, innerlight, wisdom",
124.jpg,https://scontent-zrh1-1.cdninstagram.com/v/t51.29350-15/447372667_430013656652874_8077291156570828270_n.heic?stp=dst-jpg_e35&_nc_ht=scontent-zrh1-1.cdninstagram.com&_nc_cat=106&_nc_ohc=ox-mLH1cml4Q7kNvgEgssi7&edm=AA0rjkIBAAAA&ccb=7-5&oh=00_AYB7ZGdw8nvi3gDnIb6wXOOxfhF3RNzLfpNpamANxsTTog&oe=6663E197&_nc_sid=49ed71,"@1PsychicLoveExpert is a spiritual advisor. She has the power and the ability to help if you are worried,troubled, confused,she can find your true path in life. I am blessed with a true authentic intuitive gift I received through generations I specialize in energy work and healing in twin flames soulmates and other soul connections.🧿 I not only read twin flame connections with amazing accuracy but I also help twin flames connections cut karmic chords and unbalances that keep relationships from sharing a healthy and unconditionally loving relationship together.🧿 I work with all problems in life reunites lovers \nrebuild broken Relationship. \n🧿I have natural gifts to communicate with angelic energies spirit guides in the universe and through your OWN spirit guides I will be able to reveal insightful and accurate messages they will advise me to share with you during the reading.\n🔴FREE SAMPLE READING \nCall Now \n I also connect through WhatsApp 001-469-476-7284 ☎️\n18+ ONLY 🔞\n\n-\n\n#twinflame #psychic #love #relationships #soulmates #twinflames #psychicreading #tarotreading #1111 #spiritual #spirituality #empath #intuition #indigo #reiki #psychiclovereading #lovespecialist #twinflamereading #twinflamehealing #twinflamereader #lovepsychic #indigo #meditation #yoga #enlightenment #aura #intuition #lightworker #soul #intuition","twinflamereader, aura, 1111, empath, enlightenment, tarotreading, twinflamereading, spiritual, twinflamehealing, reiki, psychic, soul, lovepsychic, indigo, psychicreading, psychiclovereading, yoga, lightworker, twinflame, relationships, meditation, spirituality, twinflames, intuition, lovespecialist, love, soulmates",1PsychicLoveExpert
125.jpg,https://scontent-zrh1-1.cdninstagram.com/v/t51.29350-15/447383948_2225824517758532_2349092597744367825_n.jpg?stp=dst-jpg_e15_fr_s1080x1080&_nc_ht=scontent-zrh1-1.cdninstagram.com&_nc_cat=108&_nc_ohc=VJNLbtX36fkQ7kNvgEX9PIf&edm=AA0rjkIBAAAA&ccb=7-5&oh=00_AYC9E9Op0S2YGHZJ-tzo2jbqqo7jiCSmG0y7--QxJ8E4lQ&oe=6663E7E8&_nc_sid=49ed71,"Entscheide Dich beim Aufstehen, dass dieser Tag grossartig ist, voller Liebe und Wunder und entscheide Dich für drei Gefühle, die Du den Tag durch spüren möchtest. \n\n✨\n\n#lawofassumption #love #female #weiblichkeit #gesetzderanziehung #gesetzderannahme #manifestieren #erfolg #geld #liebe #visualisieren #traumleben #lebedeintraum #manifestations #happiness #success #positiveaffirmations #spiritualgrowth #quotes #affirmation #higherself #raiseyourvibration #dailyaffirmations #enlightenment #spiritualjourney #goals","traumleben, erfolg, enlightenment, manifestations, success, manifestieren, higherself, quotes, geld, lawofassumption, gesetzderannahme, gesetzderanziehung, affirmation, spiritualgrowth, happiness, female, weiblichkeit, goals, dailyaffirmations, lebedeintraum, love, raiseyourvibration, visualisieren, spiritualjourney, positiveaffirmations, liebe",
126.jpg,https://scontent-zrh1-1.cdninstagram.com/v/t39.30808-6/447706270_17966110859740073_2272499023931429190_n.jpg?stp=dst-jpg_e15_fr_s1080x1080&_nc_ht=scontent-zrh1-1.cdninstagram.com&_nc_cat=105&_nc_ohc=1Mn5MZ3Ios8Q7kNvgEfu7DP&edm=AA0rjkIAAAAA&ccb=7-5&oh=00_AYAOKsiU8U4VsAFUW9Tc2H6-KdOQn5Ud7SlvX6jxiUlDqA&oe=6663F652&_nc_sid=49ed71,"Besides healings and tarot readings, I do offer coaching sessions. I recently broke up the time frame from just one hour to also 30 and 15 minute sessions to accommodate all. If you’re interested in booking with me please check out my website at www.rareconnections.online\n\n#god #awakening #spirituality  #twinflames #divinefeminine #divinemasculine #christconsciousness #lightworker #spiritualjourney #truth #enlightenment  #ascension #source #higherconsciousness #1111 #love #starseed #divineguidance","twinflames, awakening, divinefeminine, divinemasculine, truth, 1111, starseed, source, enlightenment, lightworker, higherconsciousness, love, god, ascension, spiritualjourney, divineguidance, christconsciousness, spirituality",
127.jpg,https://scontent-zrh1-1.cdninstagram.com/v/t51.29350-15/447556448_376635488267281_1117974811194738679_n.heic?stp=dst-jpg_e35&_nc_ht=scontent-zrh1-1.cdninstagram.com&_nc_cat=101&_nc_ohc=Xc9MeYAryQwQ7kNvgESObqb&edm=AA0rjkIBAAAA&ccb=7-5&oh=00_AYCTvmH-E6A6BdwMzJj47TFu0wEq-zOiGsGkvEXtOtGM1A&oe=66641258&_nc_sid=49ed71,#mind #meditation #mindoverbody #thoughts #infinite #unlimited #world #light #divine #blessings #love #self #selftime #opportunity #wisdom #empowerment #enlightenment #life #precious #treasure #powerwithin #positive #serve #soulconnection #reflection #selfreflection #innerlight #content #inspire #vibes,"treasure, mind, enlightenment, light, soulconnection, positive, selfreflection, selftime, vibes, opportunity, serve, precious, reflection, blessings, content, self, inspire, powerwithin, unlimited, life, infinite, divine, thoughts, meditation, mindoverbody, love, world, empowerment, innerlight, wisdom",
128.jpg,https://scontent-zrh1-1.cdninstagram.com/v/t51.29350-15/447102066_434303762869194_2626790263882675718_n.heic?stp=dst-jpg_e35&_nc_ht=scontent-zrh1-1.cdninstagram.com&_nc_cat=106&_nc_ohc=Ycjzn4dJYRwQ7kNvgFzWxGt&edm=AA0rjkIBAAAA&ccb=7-5&oh=00_AYC8JxEi722GW8j4zvn1z51V996gfiYBQFoIa0qA3mVolw&oe=66640357&_nc_sid=49ed71,"When Ahmed Shah Abdali was killing people in Delhi and Mathura, he came to Gokul and was killing people brutally. When women were being raped, Ahmed Shah Abdali came face to face with Naga Sadhus in Gokul.\n\nSome 5 thousand revered Naga Sadhus wielding tongs immediately transformed into an army and clashed with the negro, illiterate Jihadi army worth lakhs.\n\nAt first, Abdali was making fun of the sadhus, but after some time, after seeing his soldiers in tatters, Abdali realized that these sadhus had actually become Mahakal and entered the battle for the identity of their land.\n\n2000 Naga Sadhus, standing like a mountain with tongs, tridents in front of cannons and swords, attained martyrdom in this fierce battle, but the biggest thing was that the enemy's army could not advance even four steps and was destroyed where it was or retreated. Ran away..\n\nAfter this, such terror arose that if any Jihadi invader came to know that Naga Sadhus were taking part in the war, then that invader would not have fought at all. He would run away with his tail tucked in fear.\n\nThere is nothing bigger than our misfortune that today we remember the barbaric robbers like Aurangzeb, Taimur, Akbar, but do not know anything about these brave Indian warriors who have sacrificed their lives for the country and religion at every step.\n\nFollow @losttemple7 for more 🙏🔱",,losttemple7
129.jpg,https://scontent-zrh1-1.cdninstagram.com/v/t51.29350-15/447339554_7610453805717467_4703578088353375443_n.heic?stp=dst-jpg_e35&_nc_ht=scontent-zrh1-1.cdninstagram.com&_nc_cat=111&_nc_ohc=hs7sbDvtCSAQ7kNvgExGhdp&edm=AA0rjkIBAAAA&ccb=7-5&oh=00_AYC8wQlwWYX2KDo3fAaJNIltF_N7BrT7lZwKJg-MyqLUyQ&oe=66640EE4&_nc_sid=49ed71,#mind #meditation #mindoverbody #thoughts #infinite #unlimited #world #light #divine #blessings #love #self #selftime #opportunity #wisdom #empowerment #enlightenment #life #precious #treasure #powerwithin #positive #serve #soulconnection #reflection #selfreflection #innerlight #content #inspire #vibes,"treasure, mind, enlightenment, light, soulconnection, positive, selfreflection, selftime, vibes, opportunity, serve, precious, reflection, blessings, content, self, inspire, powerwithin, unlimited, life, infinite, divine, thoughts, meditation, mindoverbody, love, world, empowerment, innerlight, wisdom",
130.jpg,https://scontent-zrh1-1.cdninstagram.com/v/t51.29350-15/447379954_823662322566629_3281368551700304851_n.jpg?stp=dst-jpg_e15_fr_s1080x1080&_nc_ht=scontent-zrh1-1.cdninstagram.com&_nc_cat=105&_nc_ohc=mAK0C8132cUQ7kNvgF6trTY&edm=AA0rjkIBAAAA&ccb=7-5&oh=00_AYADF32IPgesY0GgLDrSBxbBimvqcMn1r7q9fxl7SLwN4g&oe=6663E47E&_nc_sid=49ed71,Vertraue Deiner Intuition. Kehre zurück in Deiner Weiblichkeit und verbinde Dich mit Deiner Intuition.\n\n✨\n\n#lawofassumption #love #female #weiblichkeit #gesetzderanziehung #gesetzderannahme #manifestieren #erfolg #geld #liebe #visualisieren #traumleben #lebedeintraum #manifestations #happiness #success #positiveaffirmations #spiritualgrowth #quotes #affirmation #higherself #raiseyourvibration #dailyaffirmations #enlightenment #spiritualjourney #goals,"traumleben, erfolg, enlightenment, manifestations, success, manifestieren, higherself, quotes, geld, lawofassumption, gesetzderannahme, gesetzderanziehung, affirmation, spiritualgrowth, happiness, female, weiblichkeit, goals, dailyaffirmations, lebedeintraum, love, raiseyourvibration, visualisieren, spiritualjourney, positiveaffirmations, liebe",
131.jpg,https://scontent-zrh1-1.cdninstagram.com/v/t51.29350-15/447352604_1296296951758303_3129734911399091340_n.heic?stp=dst-jpg_e35&_nc_ht=scontent-zrh1-1.cdninstagram.com&_nc_cat=107&_nc_ohc=lnXYVUSO7kAQ7kNvgEoT7m8&edm=AA0rjkIBAAAA&ccb=7-5&oh=00_AYDcHV0cp3DF7MtnjbFioxhq1A-PpmsvRv8foDQqJ74vUg&oe=66640465&_nc_sid=49ed71,"@1PsychicLoveExpert is a spiritual advisor. She has the power and the ability to help if you are worried,troubled, confused,she can find your true path in life. I am blessed with a true authentic intuitive gift I received through generations I specialize in energy work and healing in twin flames soulmates and other soul connections.🧿 I not only read twin flame connections with amazing accuracy but I also help twin flames connections cut karmic chords and unbalances that keep relationships from sharing a healthy and unconditionally loving relationship together.🧿 I work with all problems in life reunites lovers \nrebuild broken Relationship. \n🧿I have natural gifts to communicate with angelic energies spirit guides in the universe and through your OWN spirit guides I will be able to reveal insightful and accurate messages they will advise me to share with you during the reading.\n🔴FREE SAMPLE READING \nCall Now \n I also connect through WhatsApp 001-469-476-7284 ☎️\n18+ ONLY 🔞\n\n-\n\n#twinflame #psychic #love #relationships #soulmates #twinflames #psychicreading #tarotreading #1111 #spiritual #spirituality #empath #intuition #indigo #reiki #psychiclovereading #lovespecialist #twinflamereading #twinflamehealing #twinflamereader #lovepsychic #indigo #meditation #yoga #enlightenment #aura #intuition #lightworker #soul #intuition","twinflamereader, aura, 1111, empath, enlightenment, tarotreading, twinflamereading, spiritual, twinflamehealing, reiki, psychic, soul, lovepsychic, indigo, psychicreading, psychiclovereading, yoga, lightworker, twinflame, relationships, meditation, spirituality, twinflames, intuition, lovespecialist, love, soulmates",1PsychicLoveExpert
132.jpg,https://scontent-zrh1-1.cdninstagram.com/v/t51.29350-15/447376321_1602341820610301_4739482214392959698_n.webp?stp=dst-jpg_e35_s1080x1080&_nc_ht=scontent-zrh1-1.cdninstagram.com&_nc_cat=105&_nc_ohc=pnXTtwd4VD0Q7kNvgH44PvQ&edm=AA0rjkIBAAAA&ccb=7-5&oh=00_AYBbnaqr1cmfZS30g88m9jz8fEkDWBI5LiZ3xHANnGIY3Q&oe=66640716&_nc_sid=49ed71,💯,,
